,Drumming_bout,Subspecies,Population,Community,Individual,Date,File_Name,Total_bout_duration,Summed_Total_bout_duration,Summed_Total_bout_duration_val,Check_Matching_Total_bout_duration,N_beats,N_Interbeats,Summed_N_Interbeats,Check_Matching_N_Interbeats,Interbeat 1,Interbeat 2,Interbeat 3,Interbeat 4,Interbeat 5,Interbeat 6,Interbeat 7,Interbeat 8,Interbeat 9,Interbeat 10,Interbeat 11,Interbeat 12,Interbeat 13,Interbeat 14,Interbeat 15,Interbeat 16,Interbeat 17,Interbeat 18,Interbeat 19,Interbeat 20,Interbeat 21,Interbeat 22,Interbeat 23,Interbeat 24,Interbeat 25,Interbeat 26,With_Ph,Start_Ph,End_Ph,Start_Ph_N,End_Ph_N,Note_Ph,Context_Before,Context_After,Context,Tree_Species,DBH
0,1,EAC,Budongo,Sonso,HW,16.10.18,ASO586 Sonso HW single ph drum traveling (beh data - traveling-AFT).WAV,0.69438,0.69438,0.69438,0.0,4,3,3,0,0.06009,0.565635,0.068652,,,,,,,,,,,,,,,,,,,,,,,,With,Build-Up,Build-Up,1,1,NV,Traveling,AFT,AFT,NV,NV
1,2,EAC,Budongo,Sonso,HW,16.10.18,ASO589 Sonso HW single ph drum (beh data - traveling).WAV,0.08839,0.08839,0.08839,0.0,2,1,1,0,0.088391,,,,,,,,,,,,,,,,,,,,,,,,,,With,Climax,Climax,2,2,NV,Traveling,Traveling,Traveling,NV,NV
2,3,EAC,Budongo,Sonso,HW,16.10.18,ASO590 Sonso HW single ph drum (beh data - resting).WAV,0.73884,0.73884,0.73884,0.0,4,3,3,0,0.089657,0.523,0.126184,,,,,,,,,,,,,,,,,,,,,,,,With,Build-Up,Build-Up,1,1,NV,Resting,Resting,Resting,NV,NV
3,4,EAC,Budongo,Sonso,FK,18.10.18,ASO636 Sonso FK single ph drum traveling (beh data - traveling).WAV,0.06392,0.06392,0.06392,0.0,2,1,1,0,0.063922,,,,,,,,,,,,,,,,,,,,,,,,,,With,Build-Up,Build-Up,1,1,NV,Traveling,Traveling,Traveling,NV,NV
4,5,EAC,Budongo,Sonso,MB,24.10.18,ASO691 Sonso MB ML group ph drum (beh data - traveling).WAV,2.2991,2.2991,2.2991,0.0,8,7,7,0,0.076402,0.687372,0.089657,0.637562,0.089657,0.614318,0.104133,,,,,,,,,,,,,,,,,,,,With,Climax,Climax,2,2,NV,Traveling,Traveling,Traveling,NV,NV
5,6,EAC,Budongo,Sonso,ZL,27.10.18,"ASO775 Sonso HW KT group ph, ZL single ph drum (beh data - traveling-feeding).WAV",1.47768,1.47768,1.47768,0.0,5,4,4,0,0.073054,0.189276,1.122375,0.092978,,,,,,,,,,,,,,,,,,,,,,,With,Climax,Climax,2,2,NV,Traveling,Feeding,Traveling,NV,NV
6,7,EAC,Budongo,Sonso,ZL,27.10.18,"ASO778 Sonso ZL single ph start, ZL single ph drum (beh data - traveling-resting).WAV",1.26184,1.26184,1.26184,0.0,13,12,12,0,0.119543,0.092978,0.076375,0.109581,0.109581,0.109581,0.149429,0.083016,0.149429,0.066413,0.152749,0.043168,,,,,,,,,,,,,,,With,Climax,Climax,2,2,NV,Traveling,Resting,Traveling,NV,NV
7,8,EAC,Budongo,Sonso,ZL,27.10.18,ASO780 Sonso ZL single ph drum (beh data - traveling) .WAV,1.49429,1.49428,1.49428,0.0,15,14,14,0,0.06593,0.131165,0.059771,0.111241,0.059771,0.164371,0.079695,0.126184,0.141127,0.086337,0.129505,0.097959,0.132825,0.108403,,,,,,,,,,,,,With,Climax,Let-Down,2,3,NV,Traveling,Traveling,Traveling,NV,NV
8,9,EAC,Budongo,Sonso,ZL,27.10.18,ASO782 Sonso ZL single ph drum (beh data - traveling-resting).WAV,1.57962,1.57962,1.57962,0.0,16,15,15,0,0.12186,0.10294,0.092978,0.069733,0.092978,0.142787,0.112902,0.122864,0.109581,0.063092,0.079695,0.162711,0.056451,0.169352,0.079695,,,,,,,,,,,,With,Climax,Climax,2,2,NV,Traveling,Resting,Traveling,NV,NV
9,10,EAC,Budongo,Sonso,ZL,27.10.18,"ASO808 Sonso ZL single ph drum display, PS single ph display.WAV",0.20859,0.20859,0.20859,0.0,3,2,2,0,0.104294,0.104294,,,,,,,,,,,,,,,,,,,,,,,,,With,Climax,Climax,2,2,NV,Display,Display,Display,NV,NV
10,11,EAC,Budongo,Sonso,MS,05.11.18,ASO936 Sonso MS single ph drum (beh data- resting).WAV,1.28763,1.28763,1.28763,0.0,5,4,4,0,0.076215,0.786219,0.084238,0.340962,,,,,,,,,,,,,,,,,,,,,,,With,Climax,Climax,2,2,NV,Resting,Resting,Resting,NV,NV
11,12,EAC,Budongo,Sonso,KS,12.11.18,"ASO1013 Sonso KS single ph drum (beh data - traveling), 1;15 KS single ph drum, 1;50 KS single ph.WAV",0.11232,0.11232,0.11232,0.0,2,1,1,0,0.112317,,,,,,,,,,,,,,,,,,,,,,,,,,With,Climax,Climax,2,2,NV,Traveling,Traveling,Traveling,NV,NV
12,13,EAC,Budongo,Sonso,KS,12.11.18,"ASO1013 Sonso KS single ph drum (beh data - traveling), 1;15 KS single ph drum, 1;50 KS single ph.WAV",0.07622,0.07622,0.07622,0.0,2,1,1,0,0.076215,,,,,,,,,,,,,,,,,,,,,,,,,,With,Climax,Climax,2,2,NV,Traveling,Enter tree,AFT,NV,NV
13,14,EAC,Budongo,Sonso,ZD,13.11.18,"ASO1029 Sonso ZD single ph drum traveling, single ph 100m.WAV",1.45361,1.45361,1.45361,0.0,6,5,5,0,0.078676,0.642543,0.068073,0.582771,0.081545,,,,,,,,,,,,,,,,,,,,,,With,Unk,Let-Down,0,3,NV,Traveling,Traveling,Traveling,NV,NV
14,15,EAC,Budongo,Sonso,ZD,13.11.18,ASO1031 Sonso ZD single ph drum traveling.WAV,0.09427,0.09427,0.09427,0.0,2,1,1,0,0.094266,,,,,,,,,,,,,,,,,,,,,,,,,,With,Let-Down,Let-Down,3,3,NV,Traveling,Traveling,Traveling,NV,NV
15,16,EAC,Budongo,Sonso,ZD,13.11.18,ASO1032 Sonso ZD single ph drum traveling.WAV,1.38739,1.3873,1.3873,0.0,6,5,5,0,0.06247,0.677913,0.112317,0.467319,0.067285,,,,,,,,,,,,,,,,,,,,,,With,Climax,Climax,2,2,NV,Traveling,Traveling,Traveling,NV,NV
16,17,EAC,Budongo,Sonso,ZD,13.11.18,ASO1032 Sonso ZD single ph drum traveling.WAV,0.89854,0.89854,0.89854,0.0,4,3,3,0,0.050142,0.778196,0.070198,,,,,,,,,,,,,,,,,,,,,,,,With,Let-Down,Let-Down,3,3,Same call as before but drummed on other tree in BUp after Climax/LD,Traveling,Traveling,Traveling,NV,NV
17,18,EAC,Budongo,Sonso,ZD,13.11.18,ASO1033 Sonso ZD single ph drum traveling.WAV,0.84577,0.84577,0.84577,0.0,3,2,2,0,0.111705,0.734065,,,,,,,,,,,,,,,,,,,,,,,,,With,Climax,Climax,2,2,NV,Traveling,Traveling,Traveling,NV,NV
18,19,EAC,Budongo,Sonso,ZD,13.11.18,ASO1034 Sonso ZD single ph drum traveling.WAV,0.70614,0.70614,0.70614,0.0,4,3,3,0,0.053567,0.574485,0.078086,,,,,,,,,,,,,,,,,,,,,,,,With,Let-Down,Let-Down,3,3,Same call as before but drummed on other tree in BUp after Climax/LD,Traveling,Traveling,Traveling,NV,NV
19,20,EAC,Budongo,Sonso,ZD,13.11.18,"ASO1035 Sonso unk group ph 100m, 0;30 ZD single ph drum (traveling-AFT), FK unk single ph drum 100m.WAV",0.48537,0.48537,0.48537,0.0,3,2,2,0,0.102289,0.383081,,,,,,,,,,,,,,,,,,,,,,,,,With,Climax,Let-Down,2,3,NV,Traveling,AFT,AFT,NV,NV
20,21,EAC,Budongo,Sonso,FK,13.11.18,ASO1070 Sonso FK single ph drum (beh data - resting).WAV,0.0,0.0,0.0,0.0,1,0,0,0,,,,,,,,,,,,,,,,,,,,,,,,,,,With,Let-Down,Let-Down,3,3,BuildUp after Climax,Resting,NV,Resting,NV,NV
21,22,EAC,Budongo,Sonso,FK,13.11.18,"ASO1079 Sonso FK single ph drum ( beh data - traveling), unk_m single ph.WAV",1.44673,1.44673,1.44673,0.0,4,3,3,0,0.071511,1.267031,0.108184,,,,,,,,,,,,,,,,,,,,,,,,With,Unk,Unk,0,0,Overlap with other calls,Traveling,Traveling,Traveling,NV,NV
22,23,EAC,Budongo,Sonso,FK,13.11.18,"ASO1080 Sonso Thermal Camera FK resting, FK single ph drum.WAV",2.04176,2.04176,2.04176,0.0,8,7,7,0,0.072204,0.581641,0.068192,0.581641,0.064181,0.605709,0.068192,,,,,,,,,,,,,,,,,,,,With,Build-Up,Let-Down,1,3,BuildUp after Climax,Traveling,Traveling,Traveling,NV,NV
23,24,EAC,Budongo,Sonso,JS,21.11.18,"ASO1116  Sonso JS single ph drum (beh data - resting), HW RH group ph.WAV",0.12636,0.12636,0.12636,0.0,2,1,1,0,0.126357,,,,,,,,,,,,,,,,,,,,,,,,,,With,Let-Down,Let-Down,3,3,NV,Resting,Resting,Resting,NV,NV
24,25,EAC,Budongo,Sonso,SM,22.11.18,ASO1126 Sonso SM single ph drum (beh data - traveling).WAV,4.39091,4.39091,4.39091,0.0,8,7,7,0,0.104886,0.161515,0.550621,0.948826,0.910359,0.966594,0.748104,,,,,,,,,,,,,,,,,,,,With,Build-Up,Build-Up,1,1,NV,Traveling,Traveling,Traveling,NV,NV
25,26,EAC,Budongo,Sonso,KZ,30.11.18,ASO1231 Sonso KZ single ph drum resting-traveling (beh data resting-traveling-AFT).WAV,0.85441,0.85441,0.85441,0.0,5,4,4,0,0.072204,0.180509,0.328928,0.27277,,,,,,,,,,,,,,,,,,,,,,,With,Climax,Climax,2,2,NV,Resting,Enter tree,AFT,NV,NV
26,27,EAC,Budongo,Sonso,KS,01.12.18,ASO1252 Sonso KS single ph drum (beh data - traveling).WAV,0.07421,0.07421,0.07421,0.0,2,1,1,0,0.074209,,,,,,,,,,,,,,,,,,,,,,,,,,With,Build-Up,Build-Up,1,1,NV,Traveling,Traveling,Traveling,NV,NV
27,28,EAC,Budongo,Sonso,HW,01.12.18,"ASO1267 Sonso HW single ph drum (beh data - traveling), HW ZF group ph.WAV",0.07772,0.07772,0.07772,0.0,2,1,1,0,0.077719,,,,,,,,,,,,,,,,,,,,,,,,,,With,Climax,Climax,2,2,NV,Resting,Traveling,Traveling,NV,NV
28,29,EAC,Budongo,Sonso,HW,01.12.18,"ASO1281 Sonso HW single ph drum (beh data - resting), SM single ph.WAV",0.06864,0.06864,0.06864,0.0,2,1,1,0,0.068644,,,,,,,,,,,,,,,,,,,,,,,,,,With,Climax,Climax,2,2,NV,Resting,Resting,Resting,NV,NV
29,30,EAC,Budongo,Sonso,HW,01.12.18,"ASO1282 Sonso HW single ph drum (beh data - resting), SM single ph.WAV",0.088,0.088,0.088,0.0,2,1,1,0,0.087997,,,,,,,,,,,,,,,,,,,,,,,,,,With,Climax,Climax,2,2,NV,Resting,Resting,Resting,NV,NV
30,31,EAC,Budongo,Sonso,HW,01.12.18,"ASO1283 Sonso HW single ph drum (beh data - resting), SM single ph start.WAV",0.09057,0.09057,0.09057,0.0,2,1,1,0,0.090568,,,,,,,,,,,,,,,,,,,,,,,,,,With,Build-Up,Build-Up,1,1,NV,Resting,Resting,Resting,NV,NV
31,32,EAC,Budongo,Sonso,SM,19.03.19,1801 SM single ph drum traveling.WAV,0.08053,0.08053,0.08053,0.0,2,1,1,0,0.080525,,,,,,,,,,,,,,,,,,,,,,,,,,With,Build-Up,Build-Up,1,1,NV,Traveling,Traveling,Traveling,NV,NV
32,33,EAC,Budongo,Sonso,PS,31.03.19,1952 PS single ph drum traveling (beh data-traveling).WAV,2.22895,2.22895,2.22895,0.0,13,12,12,0,0.148619,0.208388,0.077477,0.199741,0.116216,0.189686,0.092171,0.238227,0.081485,0.354858,0.27785,0.244231,,,,,,,,,,,,,,,With,Climax,Climax,2,2,NV,Traveling,Traveling,Traveling,NV,NV
33,34,EAC,Budongo,Sonso,PS,31.03.19,1952 PS single ph drum traveling (beh data-traveling).WAV,0.0,0.0,0.0,0.0,1,0,0,0,,,,,,,,,,,,,,,,,,,,,,,,,,,With,Let-Down,Let-Down,3,3,Same call as before but drummed on other 2 trees,Traveling,Traveling,Traveling,NV,NV
34,35,EAC,Budongo,Sonso,PS,31.03.19,1952 PS single ph drum traveling (beh data-traveling).WAV,0.18334,0.18334,0.18334,0.0,2,1,1,0,0.183336,,,,,,,,,,,,,,,,,,,,,,,,,,With,Let-Down,Let-Down,3,3,Same call as before but drummed on other 2 trees,Traveling,Traveling,Traveling,NV,NV
35,36,EAC,Budongo,Sonso,HW,06.04.19,"2038 HW single ph drum (beh data - resting), IN DL JS group ph .WAV",0.06733,0.06733,0.06733,0.0,2,1,1,0,0.067326,,,,,,,,,,,,,,,,,,,,,,,,,,With,Build-Up,Build-Up,1,1,Pause BuildUp-Climax,Resting,Traveling,Traveling,NV,NV
36,37,EAC,Budongo,Sonso,HW,06.04.19,"2039 HW single ph drum (beh data resting-traveling), JS DL group ph start.WAV",0.0963,0.0963,0.0963,0.0,2,1,1,0,0.096298,,,,,,,,,,,,,,,,,,,,,,,,,,With,Climax,Climax,2,2,Grunty climax,Resting,Traveling,Traveling,NV,NV
37,38,EAC,Budongo,Sonso,HW,06.04.19,"2039 HW single ph drum (beh data resting-traveling), JS DL group ph start.WAV",0.08966,0.08966,0.08966,0.0,2,1,1,0,0.089657,,,,,,,,,,,,,,,,,,,,,,,,,,With,Let-Down,Let-Down,3,3,Same call as before but drummed on other tree,Resting,Traveling,Traveling,NV,NV
38,39,EAC,Budongo,Sonso,HW?,06.04.19,"2048 JS HW group ph drum (traveling), JS HW group ph drum, HW single ph drum (display during traveling), JS HW group ph drum (display during traveling), JS HW group ph drum, JS single ph (traveling).WAV",0.05949,0.05949,0.05949,0.0,2,1,1,0,0.059489,,,,,,,,,,,,,,,,,,,,,,,,,,With,Build-Up,Build-Up,1,1,No Climax,Display,Display,Display,NV,NV
39,40,EAC,Budongo,Sonso,HW,06.04.19,"2048 JS HW group ph drum (traveling), JS HW group ph drum, HW single ph drum (display during traveling), JS HW group ph drum (display during traveling), JS HW group ph drum, JS single ph (traveling).WAV",0.07471,0.07471,0.07471,0.0,2,1,1,0,0.074714,,,,,,,,,,,,,,,,,,,,,,,,,,With,Build-Up,Build-Up,1,1,No Climax,Display,Display,Display,NV,NV
40,41,EAC,Budongo,Sonso,HW?,06.04.19,"2048 JS HW group ph drum (traveling), JS HW group ph drum, HW single ph drum (display during traveling), JS HW group ph drum (display during traveling), JS HW group ph drum, JS single ph (traveling).WAV",0.0797,0.0797,0.0797,0.0,2,1,1,0,0.079695,,,,,,,,,,,,,,,,,,,,,,,,,,With,Build-Up,Build-Up,1,1,Multiple climaxes like screams from drummer?,Display,Display,Display,NV,NV
41,42,EAC,Budongo,Sonso,MS,16.04.19,"2152 MS single ph drum (beh data-resting), 2;40 NB group ph, unk_m single ph other party, MS single ph drum.WAV",0.0,0.0,0.0,0.0,1,0,0,0,,,,,,,,,,,,,,,,,,,,,,,,,,,With,Build-Up,Build-Up,1,1,No Climax,Resting,Resting,Resting,NV,NV
42,43,EAC,Budongo,Sonso,MS,16.04.19,"2160 Thermal Camera (cont) MS single ph drum (beh data-resting), group ph 50m, group ph 100m.WAV",1.11407,1.11407,1.11407,0.0,4,3,3,0,0.167692,0.873327,0.073054,,,,,,,,,,,,,,,,,,,,,,,,With,Roar,Climax,1,2,NV,Resting,Resting,Resting,NV,NV
43,44,EAC,Budongo,Sonso,ZD,07.06.19,2565 ZD single ph drum traveling (beh data-traveling).WAV,0.84676,0.84676,0.84676,0.0,4,3,3,0,0.097129,0.650921,0.098713,,,,,,,,,,,,,,,,,,,,,,,,With,Climax,Let-Down,2,3,NV,Traveling,Traveling,Traveling,NV,NV
44,45,EAC,Budongo,Sonso,ZD,07.06.19,2566 ZD single ph drum traveling (beh data-traveling).WAV,0.0963,0.0963,0.0963,0.0,2,1,1,0,0.096298,,,,,,,,,,,,,,,,,,,,,,,,,,With,Build-Up,Build-Up,2,1,NV,Traveling,Traveling,Traveling,NV,NV
45,46,EAC,Budongo,Sonso,ZD,07.06.19,2566 ZD single ph drum traveling (beh data-traveling).WAV,0.09962,0.09962,0.09962,0.0,2,1,1,0,0.099619,,,,,,,,,,,,,,,,,,,,,,,,,,With,Let-Down,Let-Down,3,3,Same call as before but drummed on other tree,Traveling,Traveling,Traveling,NV,NV
46,47,EAC,Budongo,Sonso,ZD,07.06.19,2567 ZD single ph drum traveling (beh data-traveling).WAV,0.07305,0.07305,0.07305,0.0,2,1,1,0,0.073054,,,,,,,,,,,,,,,,,,,,,,,,,,With,Let-Down,Let-Down,3,3,NV,Traveling,Traveling,Traveling,NV,NV
47,48,EAC,Budongo,Sonso,ZD,07.06.19,2568 ZD single ph drum traveling (beh data-traveling).WAV,0.04981,0.04981,0.04981,0.0,2,1,1,0,0.04981,,,,,,,,,,,,,,,,,,,,,,,,,,With,Let-Down,Let-Down,3,3,NV,Traveling,Traveling,Traveling,NV,NV
48,49,EAC,Budongo,Sonso,ZD,07.06.19,2570 ZD single ph drum traveling (beh data-traveling).WAV,0.78367,0.78367,0.78367,0.0,3,2,2,0,0.089657,0.694013,,,,,,,,,,,,,,,,,,,,,,,,,With,Pause,Climax,1,2,Pause BuildUp-Climax,Traveling,Traveling,Traveling,NV,NV
49,50,EAC,Budongo,Sonso,PS,26.06.19,2822 PS single ph drum (beh data-traveling).WAV,0.42836,0.42836,0.42836,0.0,4,3,3,0,0.087167,0.278933,0.062262,,,,,,,,,,,,,,,,,,,,,,,,With,Let-Down,Let-Down,3,3,NV,Traveling,Resting,Traveling,NV,NV
50,51,EAC,Budongo,Sonso,HW,14.07.19,"3080 HW single ph drum traveling, 2;00 HW single ph drum traveling-resting, 5;20 HW single ph drum traveling-resting.WAV",1.74665,1.74665,1.74665,0.0,5,4,4,0,0.082644,0.571149,0.063092,1.029768,,,,,,,,,,,,,,,,,,,,,,,With,Build-Up,Build-Up,1,1,No Climax,Traveling,Traveling,Traveling,NV,NV
51,52,EAC,Budongo,Sonso,HW,14.07.19,"3080 HW single ph drum traveling, 2;00 HW single ph drum traveling-resting, 5;20 HW single ph drum traveling-resting.WAV",1.04419,1.04419,1.04419,0.0,6,5,5,0,0.101181,0.210457,0.437102,0.101181,0.194268,,,,,,,,,,,,,,,,,,,,,,With,Build-Up,Climax,1,2,NV,Traveling,Resting,Traveling,NV,NV
52,53,EAC,Budongo,Sonso,HW,14.07.19,"3080 HW single ph drum traveling, 2;00 HW single ph drum traveling-resting, 5;20 HW single ph drum traveling-resting.WAV",0.10118,0.10118,0.10118,0.0,2,1,1,0,0.101181,,,,,,,,,,,,,,,,,,,,,,,,,,With,Build-Up,Build-Up,1,1,NV,Traveling,Resting,Traveling,NV,NV
53,54,EAC,Budongo,Sonso,HW,14.07.19,"3081 HW single ph drum traveling, 3;15 HW display stomp, FK fg.WAV",0.05977,0.05977,0.05977,0.0,2,1,1,0,0.059771,,,,,,,,,,,,,,,,,,,,,,,,,,With,Roar,Roar,1,1,Roar before climax,Traveling,Traveling,Traveling,NV,NV
54,55,EAC,Budongo,Sonso,ZD,22.07.19,3105 ZD single ph drum (beh data-traveling).WAV,0.92978,0.92978,0.92978,0.0,4,3,3,0,0.081738,0.747143,0.100897,,,,,,,,,,,,,,,,,,,,,,,,With,Build-Up,Build-Up,1,1,No Climax,Traveling,Traveling,Traveling,NV,NV
55,56,EAC,Budongo,Sonso,ZD,22.07.19,"3106 ZD group ph drum (beh data traveling), unk group ph other party, ZD single ph drum (beh data traveling-AFT).WAV",0.93891,0.93891,0.93891,0.0,4,3,3,0,0.10709,0.758765,0.073054,,,,,,,,,,,,,,,,,,,,,,,,With,Build-Up,Roar,1,1,No Climax,Traveling,Traveling,Traveling,NV,NV
56,57,EAC,Budongo,Sonso,ZD,22.07.19,"3106 ZD group ph drum (beh data traveling), unk group ph other party, ZD single ph drum (beh data traveling-AFT).WAV",1.72127,1.72127,1.72127,0.0,8,7,7,0,0.100268,0.718587,0.155972,0.072416,0.31473,0.155972,0.203321,,,,,,,,,,,,,,,,,,,,With,Build-Up,Climax,1,2,NV,Traveling,Enter tree,AFT,NV,NV
57,58,EAC,Budongo,Sonso,KT,23.07.19,"3134 MS unk group ph, KT single ph drum (beh context-aggression), ZL single ph, rest?.WAV",0.1245,0.1245,0.1245,0.0,2,1,1,0,0.1245,,,,,,,,,,,,,,,,,,,,,,,,,,With,Let-Down,Let-Down,3,3,NV,Display,Display,Display,NV,NV
58,59,EAC,Budongo,Sonso,FK,27.07.19,"3191 FK ph drum (beh data traveling-resting), FK ph drum.WAV",0.97627,0.97627,0.97627,0.0,5,4,4,0,0.442772,0.292216,0.166032,0.075247,,,,,,,,,,,,,,,,,,,,,,,With,Roar,Unk,1,0,Unk because overlap with other calls,Traveling,Resting,Traveling,NV,NV
59,60,EAC,Budongo,Sonso,FK,27.07.19,3192 FK single ph drum (beh data-resting).WAV,1.12071,1.12072,1.12072,0.0,5,4,4,0,0.028225,0.777029,0.086337,0.229124,,,,,,,,,,,,,,,,,,,,,,,With,Build-Up,Let-Down,1,3,NV,Resting,Resting,Resting,NV,NV
60,61,EAC,Budongo,Sonso,MS,23.08.18,"ASO042 Sonso unk group M/F ph, MS single M ph drum (display), unk group M/F ph.WAV",0.87665,0.87665,0.87665,0.0,4,3,3,0,0.205879,0.101279,0.569489,,,,,,,,,,,,,,,,,,,,,,,,Without,0,0,0,0,NV,Display,Display,Display,NV,NV
61,62,EAC,Budongo,Sonso,MS,23.08.18,"ASO042 Sonso unk group M/F ph, MS single M ph drum (display), unk group M/F ph.WAV",0.19509,0.19509,0.19509,0.0,2,1,1,0,0.195087,,,,,,,,,,,,,,,,,,,,,,,,,,Without,0,0,0,0,NV,Display,Display,Display,NV,NV
62,63,EAC,Budongo,Sonso,MS,23.08.18,"ASO042 Sonso unk group M/F ph, MS single M ph drum (display), unk group M/F ph.WAV",0.14298,0.14298,0.14298,0.0,2,1,1,0,0.142975,,,,,,,,,,,,,,,,,,,,,,,,,,Without,0,0,0,0,NV,Display,Display,Display,NV,NV
63,64,EAC,Budongo,Sonso,MS,23.08.18,"ASO042 Sonso unk group M/F ph, MS single M ph drum (display), unk group M/F ph.WAV",0.13947,0.13947,0.13947,0.0,2,1,1,0,0.139467,,,,,,,,,,,,,,,,,,,,,,,,,,Without,0,0,0,0,NV,Display,Display,Display,NV,NV
64,65,EAC,Budongo,Sonso,MS,23.08.18,"ASO042 Sonso unk group M/F ph, MS single M ph drum (display), unk group M/F ph.WAV",0.0,0.0,0.0,0.0,1,0,0,0,,,,,,,,,,,,,,,,,,,,,,,,,,,Without,0,0,0,0,NV,Display,Display,Display,NV,NV
65,66,EAC,Budongo,Sonso,MS,23.08.18,"ASO042 Sonso unk group M/F ph, MS single M ph drum (display), unk group M/F ph.WAV",0.0,0.0,0.0,0.0,1,0,0,0,,,,,,,,,,,,,,,,,,,,,,,,,,,Without,0,0,0,0,NV,Display,Display,Display,NV,NV
66,67,EAC,Budongo,Sonso,ZF,11.09.18,ASO178 Sonso ZF single ph drum traveling.WAV,1.38475,1.38476,1.38476,0.0,8,7,7,0,0.110038,0.116229,0.145893,0.27695,0.326405,0.08902,0.320223,,,,,,,,,,,,,,,,,,,,With,Build-Up,Climax,1,2,NV,Traveling,Traveling,Traveling,NV,NV
67,68,EAC,Budongo,Sonso,KT,11.10.18,ASO488 Sonso KT single ph drum (resting).WAV,0.40198,0.40198,0.40198,0.0,3,2,2,0,0.08652,0.31546,,,,,,,,,,,,,,,,,,,,,,,,,With,Roar,Roar,1,1,"Ph roar (like BUp), No climax",Resting,Resting,Resting,NV,NV
68,69,EAC,Budongo,Sonso,FK,13.10.18,"ASO528 Sonso FK single ph drum (traveling-resting), unk single ph.WAV",1.65469,1.65469,1.65469,0.0,7,6,6,0,0.060781,0.332064,0.6276,0.073054,0.454927,0.10626,,,,,,,,,,,,,,,,,,,,,With,Roar,Let-Down,1,3,"Ph roar (like BUp), No climax",Traveling,Resting,Traveling,NV,NV
69,70,EAC,Budongo,Sonso,HW,16.10.18,ASO565 Sonso HW single ph drum traveling.WAV,0.0787,0.0787,0.0787,0.0,2,1,1,0,0.078703,,,,,,,,,,,,,,,,,,,,,,,,,,With,Build-Up,Build-Up,1,1,No Climax,Traveling,Traveling,Traveling,NV,NV
70,71,EAC,Budongo,Sonso,HW,29.10.18,"ASO871 Sonso HW single ph drum (resting), SM single ph start.WAV",0.08966,0.08966,0.08966,0.0,2,1,1,0,0.089657,,,,,,,,,,,,,,,,,,,,,,,,,,With,Roar,Roar,1,1,No Climax,Resting,Resting,Resting,NV,NV
71,72,EAC,Budongo,Sonso,PS,31.10.18,"ASO907 Sonso PS single ph drum traveling (not seen, beh data- out of sight).WAV",1.59557,1.59556,1.59556,0.0,12,11,11,0,0.158818,0.129505,0.162711,0.066413,0.149429,0.10626,0.259001,0.086337,0.215841,0.099619,0.161623,,,,,,,,,,,,,,,,With,Climax,Let-Down,2,3,NV,Traveling,Traveling,Traveling,NV,NV
72,73,EAC,Budongo,Sonso,JS,31.10.18,"ASO914 Sonso JS single ph drum (traveling), 0;45 HW single ph drum (traveling), PS single ph.WAV",0.38519,0.38519,0.38519,0.0,3,2,2,0,0.20754,0.177654,,,,,,,,,,,,,,,,,,,,,,,,,With,Build-Up,Build-Up,1,1,NV,Traveling,Traveling,Traveling,NV,NV
73,74,EAC,Budongo,Sonso,HW,31.10.18,"ASO914 Sonso JS single ph drum (traveling), 0;45 HW single ph drum (traveling), PS single ph.WAV",0.08546,0.08546,0.08546,0.0,2,1,1,0,0.085459,,,,,,,,,,,,,,,,,,,,,,,,,,With,Build-Up,Build-Up,1,1,No Climax,Traveling,Traveling,Traveling,NV,NV
74,75,EAC,Budongo,Sonso,JS,01.12.18,ASO1273 Sonso JS single ph drum traveling 50m.WAV,0.11181,0.11181,0.11181,0.0,2,1,1,0,0.111806,,,,,,,,,,,,,,,,,,,,,,,,,,With,Build-Up,Build-Up,1,1,No Climax,Traveling,Traveling,Traveling,NV,NV
75,76,EAC,Budongo,Sonso,ZL,01.12.18,ASO1276 Sonso ZL single ph drum (traveling).WAV,2.5901,2.5901,2.5901,0.0,15,14,14,0,0.081623,0.132825,0.119543,0.534622,0.086337,0.096298,0.146108,0.063092,0.711993,0.249048,0.10294,0.056451,0.05313,0.156086,,,,,,,,,,,,,With,Build-Up,Let-Down,1,3,NV,Traveling,Traveling,Traveling,NV,NV
76,77,EAC,Budongo,Sonso,JS,06.12.18,"ASO1356 Sonso JS single ph drum (AFT), 0;30 KL KC group ph.WAV",0.12951,0.12951,0.12951,0.0,2,1,1,0,0.129505,,,,,,,,,,,,,,,,,,,,,,,,,,With,Climax,Climax,2,2,NV,AFT,AFT,AFT,NV,NV
77,78,EAC,Budongo,Sonso,MB,18.03.19,1776 MB drum traveling.WAV,0.11684,0.11684,0.11684,0.0,2,1,1,0,0.116844,,,,,,,,,,,,,,,,,,,,,,,,,,Without,0,0,0,0,NV,Traveling,Traveling,Traveling,NV,NV
78,79,EAC,Budongo,Sonso,HW,18.03.19,"1785 pg, OK unk group ph, HW display drum, KH single ph.WAV",0.0,0.0,0.0,0.0,1,0,0,0,,,,,,,,,,,,,,,,,,,,,,,,,,,Without,0,0,0,0,NV,Display,Display,Display,NV,NV
79,80,EAC,Budongo,Sonso,HW,18.03.19,"1785 pg, OK unk group ph, HW display drum, KH single ph.WAV",0.0,0.0,0.0,0.0,1,0,0,0,,,,,,,,,,,,,,,,,,,,,,,,,,,Without,0,0,0,0,NV,Display,Display,Display,NV,NV
80,81,EAC,Budongo,Sonso,HW,18.03.19,"1785 pg, OK unk group ph, HW display drum, KH single ph.WAV",0.08468,0.08468,0.08468,0.0,2,1,1,0,0.084676,,,,,,,,,,,,,,,,,,,,,,,,,,Without,0,0,0,0,NV,Display,Display,Display,NV,NV
81,82,EAC,Budongo,Sonso,MS,20.03.19,"1830 NB single ph start, FK ZL display, group scream, MS display drum, ZD scream bark, ZD JS PS victim.WAV",0.95302,0.95302,0.95302,0.0,4,3,3,0,0.199238,0.15939,0.594394,,,,,,,,,,,,,,,,,,,,,,,,Without,0,0,0,0,NV,Display,Display,Display,NV,NV
82,83,EAC,Budongo,Sonso,MS,28.03.19,1916 MS single ph drum (traveling-resting).WAV,0.10792,0.10792,0.10792,0.0,2,1,1,0,0.107921,,,,,,,,,,,,,,,,,,,,,,,,,,With,Roar,Roar,1,1,No Climax,Traveling,Resting,Traveling,NV,NV
83,84,EAC,Budongo,Sonso,MS,06.06.19,"2240 MS single ph drum display, group bark.WAV",0.42504,0.42504,0.42504,0.0,2,1,1,0,0.425041,,,,,,,,,,,,,,,,,,,,,,,,,,Without,0,0,0,0,NV,Display,Display,Display,NV,NV
84,85,EAC,Budongo,Sonso,PS,11.05.19,"2313 unk KC KQ? group ph, unk pg, unk KQ? group ph, group pg, PS display drum, KA pg to PS.WAV",0.60436,0.60436,0.60436,0.0,3,2,2,0,0.343686,0.26067,,,,,,,,,,,,,,,,,,,,,,,,,Without,0,0,0,0,NV,Display,Display,Display,NV,NV
85,86,EAC,Budongo,Sonso,Unk,20.05.19,"2422 display drum, unk JS MB group ph.WAV",0.26095,0.26095,0.26095,0.0,3,2,2,0,0.132825,0.12812,,,,,,,,,,,,,,,,,,,,,,,,,Without,0,0,0,0,NV,Display,Display,Display,NV,NV
86,87,EAC,Budongo,Sonso,FK,20.05.19,"2460 FK display drum, group ph.WAV",0.75711,0.75711,0.75711,0.0,4,3,3,0,0.127436,0.04981,0.579859,,,,,,,,,,,,,,,,,,,,,,,,Without,0,0,0,0,NV,Display,Display,Display,NV,NV
87,88,EAC,Budongo,Sonso,PS,26.05.19,"2531 unk pg to SM, PS single ph drum (display), PS display, FK single ph intro.WAV",0.0,0.0,0.0,0.0,1,0,0,0,,,,,,,,,,,,,,,,,,,,,,,,,,,With,Build-Up,Build-Up,1,1,No Climax,Display,Display,Display,NV,NV
88,89,EAC,Budongo,Sonso,HW,02.05.19,2544 HW single ph drum traveling.WAV,0.09049,0.09049,0.09049,0.0,2,1,1,0,0.090487,,,,,,,,,,,,,,,,,,,,,,,,,,With,Build-Up,Build-Up,1,1,NV,Traveling,Traveling,Traveling,NV,NV
89,90,EAC,Budongo,Sonso,ZD,15.06.19,"2642 FK single ph, group fg, SM display to NB SM? single ph intro, NB scream, MB single ph, 2;30 DL hoo, SH pg-scream to HW, unk pg scream, 5;30 ZD display drum.WAV",0.0,0.0,0.0,0.0,1,0,0,0,,,,,,,,,,,,,,,,,,,,,,,,,,,Without,0,0,0,0,NV,Display,Display,Display,NV,NV
90,91,EAC,Budongo,Sonso,ZD,15.06.19,"2642 FK single ph, group fg, SM display to NB SM? single ph intro, NB scream, MB single ph, 2;30 DL hoo, SH pg-scream to HW, unk pg scream, 5;30 ZD display drum.WAV",0.0,0.0,0.0,0.0,1,0,0,0,,,,,,,,,,,,,,,,,,,,,,,,,,,Without,0,0,0,0,NV,Display,Display,Display,NV,NV
91,92,EAC,Budongo,Sonso,ZL,16.06.19,2673 ZL single ph drum (traveling).WAV,0.38851,0.38851,0.38851,0.0,3,2,2,0,0.182635,0.205879,,,,,,,,,,,,,,,,,,,,,,,,,With,Build-Up,Build-Up,1,1,"Ph roar (like BUp), No climax",Traveling,Traveling,Traveling,NV,NV
92,93,EAC,Budongo,Sonso,ZD,16.06.19,2675 ZD single ph display drum.WAV,0.73718,0.73718,0.73718,0.0,2,1,1,0,0.737181,,,,,,,,,,,,,,,,,,,,,,,,,,With,Build-Up,Build-Up,1,1,No Climax,Display,Display,Display,NV,NV
93,94,EAC,Budongo,Sonso,JS,18.06.19,2731 JS single ph drum traveling.WAV,0.48184,0.48184,0.48184,0.0,4,3,3,0,0.202902,0.122864,0.15607,,,,,,,,,,,,,,,,,,,,,,,,With,Build-Up,Build-Up,1,1,NV,Traveling,Traveling,Traveling,NV,NV
94,95,EAC,Budongo,Sonso,JS,18.06.19,"2745 JN single ph, unk pg, JS single ph other party, DL single ph intro, unk display?, JS single ph drum (joining party-traveling?), HT HD group ph, HT fg.WAV",0.31878,0.31878,0.31878,0.0,2,1,1,0,0.318781,,,,,,,,,,,,,,,,,,,,,,,,,,With,Build-Up,Build-Up,1,1,NV,Traveling,Traveling,Traveling,NV,NV
95,96,EAC,Budongo,Sonso,SM,25.06.19,"2803 Thermal Camera SM display drum, NB KC groom, group pg scream, stranger_f bark, OK pg scream.WAV",0.19335,0.19335,0.19335,0.0,3,2,2,0,0.136901,0.056451,,,,,,,,,,,,,,,,,,,,,,,,,Without,0,0,0,0,NV,Display,Display,Display,NV,NV
96,97,EAC,Budongo,Sonso,SM,25.06.19,"2805 SM single ph drum (resting-traveling), group bark Mael.WAV",0.06641,0.06641,0.06641,0.0,2,1,1,0,0.066413,,,,,,,,,,,,,,,,,,,,,,,,,,Without,0,0,0,0,NV,Resting,Traveling,Traveling,NV,NV
97,98,EAC,Budongo,Sonso,SM,25.06.19,"2805 SM single ph drum (resting-traveling), group bark Mael.WAV",0.10294,0.10294,0.10294,0.0,2,1,1,0,0.10294,,,,,,,,,,,,,,,,,,,,,,,,,,With,Build-Up,Build-Up,1,1,NV,Resting,Traveling,Traveling,NV,NV
98,99,EAC,Budongo,Sonso,PS,27.06.19,"2834 HT single ph intro, PS single ph drum (arriving feeding tree), HT single ph intro, HT pg to PS.WAV",2.22424,2.22424,2.22424,0.0,6,5,5,0,0.099033,0.235765,0.498095,0.581111,0.810235,,,,,,,,,,,,,,,,,,,,,,Without,0,0,0,0,After PH,Unk,AFT,AFT,NV,NV
99,100,EAC,Budongo,Sonso,PS,01.07.19,"2883 ZL single ph display, group scream bark, PS display drum.WAV",0.15275,0.15275,0.15275,0.0,2,1,1,0,0.152749,,,,,,,,,,,,,,,,,,,,,,,,,,Without,0,0,0,0,NV,Display,Display,Display,NV,NV
100,101,EAC,Budongo,Sonso,PS,01.07.19,"2883 ZL single ph display, group scream bark, PS display drum.WAV",0.40512,0.40512,0.40512,0.0,4,3,3,0,0.122864,0.239086,0.043168,,,,,,,,,,,,,,,,,,,,,,,,Without,0,0,0,0,NV,Display,Display,Display,NV,NV
101,102,EAC,Budongo,Sonso,JS,02.07.19,"2892 JS single ph drum, unk_m single ph, JS single ph drum traveling.WAV",1.82465,1.82464,1.82464,0.0,6,5,5,0,0.114517,0.166032,1.281765,0.189276,0.073054,,,,,,,,,,,,,,,,,,,,,,With,Build-Up,Let-Down,1,3,NV,Traveling,Traveling,Traveling,NV,NV
102,103,EAC,Budongo,Sonso,PS,04.07.19,"2925 PS display drum, unk_f group pg, HW display drum, ZD pg to HW, IS pg to PS while PS single ph start, PS HW group ph start, FK single ph drum, group ph, JS single ph drum, JS single ph drum, JS FK stranger_f group ph drum, 9;50 FK single ph.WAV",0.60436,0.60436,0.60436,0.0,4,3,3,0,0.099619,0.112902,0.391835,,,,,,,,,,,,,,,,,,,,,,,,Without,0,0,0,0,NV,Display,Display,Display,NV,NV
103,104,EAC,Budongo,Sonso,PS,04.07.19,"2925 PS display drum, unk_f group pg, HW display drum, ZD pg to HW, IS pg to PS while PS single ph start, PS HW group ph start, FK single ph drum, group ph, JS single ph drum, JS single ph drum, JS FK stranger_f group ph drum, 9;50 FK single ph.WAV",0.13398,0.13398,0.13398,0.0,2,1,1,0,0.133978,,,,,,,,,,,,,,,,,,,,,,,,,,Without,0,0,0,0,NV,Display,Display,Display,NV,NV
104,105,EAC,Budongo,Sonso,PS,04.07.19,"2925 PS display drum, unk_f group pg, HW display drum, ZD pg to HW, IS pg to PS while PS single ph start, PS HW group ph start, FK single ph drum, group ph, JS single ph drum, JS single ph drum, JS FK stranger_f group ph drum, 9;50 FK single ph.WAV",0.13449,0.13449,0.13449,0.0,2,1,1,0,0.134486,,,,,,,,,,,,,,,,,,,,,,,,,,Without,0,0,0,0,NV,Display,Display,Display,NV,NV
105,106,EAC,Budongo,Sonso,JS,04.07.19,"2925 PS display drum, unk_f group pg, HW display drum, ZD pg to HW, IS pg to PS while PS single ph start, PS HW group ph start, FK single ph drum, group ph, JS single ph drum, JS single ph drum, JS FK stranger_f group ph drum, 9;50 FK single ph.WAV",0.91982,0.91982,0.91982,0.0,6,5,5,0,0.132825,0.099619,0.099619,0.435003,0.152749,,,,,,,,,,,,,,,,,,,,,,With,Build-Up,Climax,1,2,NV,Traveling,Resting,Traveling,NV,NV
106,107,EAC,Budongo,Sonso,JS,04.07.19,"2925 PS display drum, unk_f group pg, HW display drum, ZD pg to HW, IS pg to PS while PS single ph start, PS HW group ph start, FK single ph drum, group ph, JS single ph drum, JS single ph drum, JS FK stranger_f group ph drum, 9;50 FK single ph.WAV",0.97209,0.97209,0.97209,0.0,6,5,5,0,0.112041,0.073054,0.498095,0.179314,0.109581,,,,,,,,,,,,,,,,,,,,,,With,Build-Up,Climax,1,2,NV,Resting,Resting,Resting,NV,NV
107,108,EAC,Budongo,Sonso,JS,05.07.19,"2934 SM display unk_juv, unk pg-ph, KA pg-ph, JS display at KA, OK pg to SM, KA single ph start, KA OK group ph, JS single ph drum (resting), SM display, unk single ph start.WAV",0.92978,0.92978,0.92978,0.0,2,1,1,0,0.92978,,,,,,,,,,,,,,,,,,,,,,,,,,With,Let-Down,Let-Down,3,3,NV,Resting,Resting,Resting,NV,NV
108,109,EAC,Budongo,Sonso,SM,06.07.19,"2973 unk group pg-ph start fg, unk group ph, 1;50 (117) SM display drum B-U, MZ MN group ph, ML single ph, MN single ph start.WAV",0.91982,0.91982,0.91982,0.0,5,4,4,0,0.146108,0.056451,0.428362,0.288895,,,,,,,,,,,,,,,,,,,,,,,Without,0,0,0,0,NV,Display,Display,Display,NV,NV
109,110,EAC,Budongo,Sonso,HW,13.07.19,"3061 HW single ph intro display drum, MS FK rest hoo, 1;40 HW single ph display drum, FK rest hoo.WAV",0.0797,0.0797,0.0797,0.0,2,1,1,0,0.079695,,,,,,,,,,,,,,,,,,,,,,,,,,Without,0,0,0,0,NV,Display,Display,Display,NV,NV
110,111,EAC,Budongo,Sonso,HW,13.07.19,"3061 HW single ph intro display drum, MS FK rest hoo, 1;40 HW single ph display drum, FK rest hoo.WAV",0.09132,0.09132,0.09132,0.0,2,1,1,0,0.091317,,,,,,,,,,,,,,,,,,,,,,,,,,Without,0,0,0,0,Drummed after ph,Display,Display,Display,NV,NV
111,112,EAC,Budongo,Sonso,FK,22.07.19,"3104 FK single ph display drum to ZD and indirected to ZL (both pg), FK ZL group ph drum.WAV",0.07471,0.07471,0.07471,0.0,2,1,1,0,0.074714,,,,,,,,,,,,,,,,,,,,,,,,,,Without,0,0,0,0,NV,Display,Display,Display,NV,NV
112,113,EAC,Budongo,Sonso,FK,22.07.19,"3104 FK single ph display drum to ZD and indirected to ZL (both pg), FK ZL group ph drum.WAV",0.0,0.0,0.0,0.0,1,0,0,0,,,,,,,,,,,,,,,,,,,,,,,,,,,Without,0,0,0,0,NV,Display,Display,Display,NV,NV
113,114,EAC,Budongo,Sonso,FK,22.07.19,"3104 FK single ph display drum to ZD and indirected to ZL (both pg), FK ZL group ph drum.WAV",0.25901,0.25901,0.25901,0.0,2,1,1,0,0.25901,,,,,,,,,,,,,,,,,,,,,,,,,,Without,0,0,0,0,NV,Display,Display,Display,NV,NV
114,115,EAC,Budongo,Sonso,FK,22.07.19,"3104 FK single ph display drum to ZD and indirected to ZL (both pg), FK ZL group ph drum.WAV",0.87665,0.87665,0.87665,0.0,4,3,3,0,0.129505,0.642543,0.1046,,,,,,,,,,,,,,,,,,,,,,,,Without,0,0,0,0,NV,Display,Display,Display,NV,NV
115,116,EAC,Budongo,Sonso,FK,22.07.19,"3104 FK single ph display drum to ZD and indirected to ZL (both pg), FK ZL group ph drum.WAV",0.09588,0.09588,0.09588,0.0,2,1,1,0,0.095883,,,,,,,,,,,,,,,,,,,,,,,,,,Without,0,0,0,0,NV,Display,Display,Display,NV,NV
116,117,EAC,Budongo,Sonso,FK,27.07.19,3176 FK drum (display while traveling).WAV,0.07222,0.07222,0.07222,0.0,2,1,1,0,0.072224,,,,,,,,,,,,,,,,,,,,,,,,,,Without,0,0,0,0,NV,Display,Display,Display,NV,NV
117,118,EAC,Budongo,Sonso,JS,27.07.19,3177 JS single ph drum (resting).WAV,1.1257,1.12569,1.12569,0.0,8,7,7,0,0.136146,0.092978,0.215841,0.132825,0.335384,0.10626,0.10626,,,,,,,,,,,,,,,,,,,,With,Build-Up,Climax,1,2,NV,Resting,Resting,Resting,NV,NV
118,119,EAC,Budongo,Sonso,FK,27.07.19,3178 FK single ph drum (traveling-resting).WAV,1.07589,1.07589,1.07589,0.0,4,3,3,0,0.059771,0.929778,0.086337,,,,,,,,,,,,,,,,,,,,,,,,With,Build-Up,Build-Up,1,1,No Climax,Traveling,Resting,Traveling,NV,NV
119,120,EAC,Budongo,Sonso,FK,27.07.19,3181 FK bark display drum.WAV,0.67907,0.67907,0.67907,0.0,4,3,3,0,0.069733,0.506397,0.10294,,,,,,,,,,,,,,,,,,,,,,,,Without,0,0,0,0,NV,Display,Display,Display,NV,NV
120,121,EAC,Budongo,Sonso,FK,27.07.19,"3182 FK display drum at JS, JS pg to FK.WAV",0.08634,0.08634,0.08634,0.0,2,1,1,0,0.086337,,,,,,,,,,,,,,,,,,,,,,,,,,Without,0,0,0,0,NV,Display,Display,Display,NV,NV
121,122,EAC,Budongo,Sonso,FK,27.07.19,"3182 FK display drum at JS, JS pg to FK.WAV",0.06973,0.06973,0.06973,0.0,2,1,1,0,0.069733,,,,,,,,,,,,,,,,,,,,,,,,,,Without,0,0,0,0,NV,Display,Display,Display,NV,NV
122,123,EAC,Budongo,Sonso,FK,27.07.19,3183 FK display drum at JS.WAV,0.05147,0.05147,0.05147,0.0,2,1,1,0,0.05147,,,,,,,,,,,,,,,,,,,,,,,,,,Without,0,0,0,0,NV,Display,Display,Display,NV,NV
123,124,EAC,Budongo,Sonso,FK,27.07.19,"3190 FK display drum, unk_f KA pg to FK, 2;00 MB pg to FK.WAV",0.6442,0.6442,0.6442,0.0,3,2,2,0,0.332064,0.31214,,,,,,,,,,,,,,,,,,,,,,,,,Without,0,0,0,0,NV,Display,Display,Display,NV,NV
124,125,EAC,Budongo,Sonso,FK,27.07.19,"3190 FK display drum, unk_f KA pg to FK, 2;00 MB pg to FK.WAV",0.0,0.0,0.0,0.0,1,0,0,0,,,,,,,,,,,,,,,,,,,,,,,,,,,Without,0,0,0,0,NV,Display,Display,Display,NV,NV
125,126,EAC,Budongo,Sonso,FK,27.07.19,"3190 FK display drum, unk_f KA pg to FK, 2;00 MB pg to FK.WAV",0.14943,0.14943,0.14943,0.0,2,1,1,0,0.149429,,,,,,,,,,,,,,,,,,,,,,,,,,Without,0,0,0,0,NV,Display,Display,Display,NV,NV
126,127,EAC,Budongo,Sonso,HW,06.03.19,ASO1554 HW single ph drum sick traveling.WAV,0.08966,0.08966,0.08966,0.0,2,1,1,0,0.089657,,,,,,,,,,,,,,,,,,,,,,,,,,With,Build-Up,Build-Up,1,1,No Climax,Traveling,Traveling,Traveling,NV,NV
127,128,EAC,Budongo,Sonso,HW,06.03.19,ASO1557 HW NB KC group ph drum. (HW ph drum?) traveling.WAV,0.80822,0.80822,0.80822,0.0,3,2,2,0,0.087646,0.720578,,,,,,,,,,,,,,,,,,,,,,,,,With,Build-Up,Build-Up,1,1,No Climax,Traveling,Traveling,Traveling,NV,NV
128,129,EAC,Budongo,Sonso,MS,06.12.19,"3002 06/12/2019 06;00, MS single ph drum traveling CZE 40.WAV",0.27229,0.27229,0.27229,0.0,3,2,2,0,0.182635,0.089657,,,,,,,,,,,,,,,,,,,,,,,,,With,Climax,Climax,2,2,NV,Traveling,Traveling,Traveling,CZE,40
129,130,EAC,Budongo,Sonso,ZL,06.12.19,"3005 06/12/2019 06;34, ZL single ph drum traveling CYA 60.WAV",0.73718,0.73718,0.73718,0.0,5,4,4,0,0.083016,0.185956,0.288895,0.179314,,,,,,,,,,,,,,,,,,,,,,,With,Climax,Climax,2,2,NV,Traveling,Traveling,Traveling,CYA,60
130,131,EAC,Budongo,Sonso,ZL,06.12.19,"3006 06/12/2019 06;43, ZL single ph drum (traveling-resting) CYA 50.WAV",0.48149,0.48149,0.48149,0.0,5,4,4,0,0.096298,0.126184,0.119543,0.139467,,,,,,,,,,,,,,,,,,,,,,,With,Build-Up,Climax,1,2,NV,Traveling,Resting,Traveling,CYA,50
131,132,EAC,Budongo,Sonso,SM,06.12.19,"3018 06/12/2019 09;08, HW groom ZL, 2;30 unk pg, 6;00 HW rest hoo, 11;30 ZL rest hoo, 20;00 SM hoo, HW ZL SM group ph drum resting, group ph other party, 22;20 unk single ph start other party, 26;00 HW ZL SM group ph drum, DL single ph, 30;00 ,,,.WAV",1.38706,1.38706,1.38706,0.0,5,4,4,0,0.1551,0.717257,0.142787,0.371911,,,,,,,,,,,,,,,,,,,,,,,With,Unk,Unk,0,0,Unk because overlap with other calls,Resting,Resting,Resting,CZE,50
132,133,EAC,Budongo,Sonso,HW,16.11.19,"3324 16/11/2019 06;01, HW KT group ph drum (HW drum resting).WAV",0.07638,0.07638,0.07638,0.0,2,1,1,0,0.076375,,,,,,,,,,,,,,,,,,,,,,,,,,With,Build-Up,Build-Up,1,1,"Ph roar, No climax",Resting,Resting,Resting,NV,NV
133,134,EAC,Budongo,Sonso,HW,16.11.19,"3357 16/11/2019 09;56, KT pg to HW, HW display drum.WAV",0.04981,0.04981,0.04981,0.0,2,1,1,0,0.04981,,,,,,,,,,,,,,,,,,,,,,,,,,Without,0,0,0,0,NV,Display,Display,Display,NV,NV
134,135,EAC,Budongo,Sonso,PS,21.11.19,"3462 21/11/2019 13;42, PS single ph drum traveling KA 100.WAV",2.38422,2.38422,2.38422,0.0,8,7,7,0,0.245727,0.292216,0.67741,0.172673,0.292216,0.438324,0.265651,,,,,,,,,,,,,,,,,,,,With,Build-Up,Build-Up,1,1,"No Climax, Buildup after full PH",Traveling,Traveling,Traveling,KA,100
135,136,EAC,Budongo,Sonso,FK,26.11.19,"3520 26/11/2019 07;55, FK single ph drum (traveling) KA 70, PS single ph 50m, FK single ph.WAV",0.05355,0.05355,0.05355,0.0,2,1,1,0,0.053545,,,,,,,,,,,,,,,,,,,,,,,,,,With,Build-Up,Build-Up,1,1,No Climax,Traveling,Traveling,Traveling,KA,70
136,137,EAC,Budongo,Sonso,MS,27.11.19,"3608 27/11/2019 11;40, KU single ph, MS single ph drum traveling (resting-traveling), 1;25 KU pg to NB, KU pg-ph NB group ph.WAV",0.0,0.0,0.0,0.0,1,0,0,0,,,,,,,,,,,,,,,,,,,,,,,,,,,With,Build-Up,Build-Up,1,1,No Climax,Resting,Traveling,Traveling,NV,NV
137,138,EAC,Budongo,Sonso,HW,09.12.19,"3700 09/12/2019 06;59, HW single ph drum resting-feeding? (resting) CYA 80.WAV",0.06143,0.06143,0.06143,0.0,2,1,1,0,0.061432,,,,,,,,,,,,,,,,,,,,,,,,,,With,Climax,Climax,2,2,NV,Resting,Resting,Resting,CYA,80
138,139,EAC,Budongo,Sonso,SM,09.12.19,"3704 09/12/2019 09;12, SM single ph intro traveling, NB SM unk group ph drum (SM drum, resting) CPR 80, JS single ph drum traveling, JS display to KC, unk pg-scream.WAV",2.47885,2.47885,2.47885,0.0,6,5,5,0,0.064752,0.737181,0.073054,1.500927,0.10294,,,,,,,,,,,,,,,,,,,,,,With,Build-Up,Build-Up,1,1,No Climax,Resting,Resting,Resting,CPR ,80
139,140,EAC,Budongo,Sonso,JS,09.12.19,"3704 09/12/2019 09;12, SM single ph intro traveling, NB SM unk group ph drum (SM drum, resting) CPR 80, JS single ph drum traveling, JS display to KC, unk pg-scream.WAV",0.38851,0.38851,0.38851,0.0,3,2,2,0,0.219162,0.169352,,,,,,,,,,,,,,,,,,,,,,,,,With,Build-Up,Build-Up,1,1,NV,Traveling,Traveling,Traveling,NV,NV
140,141,EAC,Budongo,Sonso,SM,09.12.19,"3718 09/12/2019 12;02, SM single ph drum (traveling-resting) CYA 100, KS FK group ph 50m.WAV",0.99685,0.99685,0.99685,0.0,4,3,3,0,0.046489,0.859044,0.0913171,,,,,,,,,,,,,,,,,,,,,,,,With,Build-Up,Roar,1,1,"Ph roar, No climax",Traveling,Resting,Traveling,CYA,100
141,142,EAC,Budongo,Sonso,FK,09.12.19,"3729 09/12/2019 13;22, FK JS group ph drum traveling-AFT, JS MS group ph drum.WAV",0.08966,0.08966,0.08966,0.0,2,1,1,0,0.089657,,,,,,,,,,,,,,,,,,,,,,,,,,With,Let-Down,Let-Down,3,3,NV,Traveling,Traveling,Traveling,NV,NV
142,143,EAC,Budongo,Sonso,HW,10.12.19,"3736 10/12/2019 05;46, unk group ph, 2;40 HW single ph drum resting STD 70.WAV",0.07873,0.07873,0.07873,0.0,2,1,1,0,0.07873,,,,,,,,,,,,,,,,,,,,,,,,,,With,Unk,Unk,0,0,Unk because overlap with other calls,Resting,Resting,Resting,STD,70
143,144,EAC,Budongo,Sonso,HW,10.12.19,"3737 10/12/2019 05;56, HW single ph drum resting-traveling STD 70, 1;15 JN single ph feeding, HW single ph.WAV",1.08585,1.08585,1.08585,0.0,4,3,3,0,0.109581,0.88661,0.089657,,,,,,,,,,,,,,,,,,,,,,,,With,Climax,Climax,2,2,NV,Resting,Traveling,Traveling,STD,70
144,145,EAC,Budongo,Sonso,HW,13.12.19,"3745 13/12/2019 06;13, KT HW SM JN group ph drum traveling-AFT STD 70.WAV",0.0868,0.0868,0.0868,0.0,2,1,1,0,0.086797,,,,,,,,,,,,,,,,,,,,,,,,,,With,Unk,Unk,0,0,Unk because overlap with other calls,Traveling,AFT,AFT,STD,70
145,146,EAC,Budongo,Sonso,SM,13.12.19,"3745 13/12/2019 06;13, KT HW SM JN group ph drum traveling-AFT STD 70.WAV",0.1129,0.1129,0.1129,0.0,2,1,1,0,0.112902,,,,,,,,,,,,,,,,,,,,,,,,,,With,Unk,Unk,0,0,Unk because overlap with other calls,Traveling,AFT,AFT,STD,70
146,147,EAC,Budongo,Sonso,FK,13.12.19,"3753 13/12/2019 07;03, 1;20 FK display drum (first drum STD 70, last drum CZE 50), MS single ph drum.WAV",1.33822,1.33822,1.33822,0.0,6,5,5,0,0.152749,0.066413,0.78367,0.225803,0.109581,,,,,,,,,,,,,,,,,,,,,,Without,0,0,0,0,NV,Display,Display,Display,STD,70
147,148,EAC,Budongo,Sonso,MS,13.12.19,"3753 13/12/2019 07;03, 1;20 FK display drum (first drum STD 70, last drum CZE 50), MS single ph drum.WAV",0.07638,0.07638,0.07638,0.0,2,1,1,0,0.076375,,,,,,,,,,,,,,,,,,,,,,,,,,With,Build-Up,Build-Up,1,1,No Climax,Traveling,Resting,Traveling,NV,NV
148,149,EAC,Budongo,Sonso,FK,13.12.19,"3753 13/12/2019 07;03, 1;20 FK display drum (first drum STD 70, last drum CZE 50), MS single ph drum.WAV",0.08468,0.08468,0.08468,0.0,2,1,1,0,0.084676,,,,,,,,,,,,,,,,,,,,,,,,,,Without,0,0,0,0,NV,Display,Display,Display,CZE,50
149,150,EAC,Budongo,Sonso,MS,14.12.19,"3770 14/12/2019 06;38, MS single ph drum traveling-resting HG 60.WAV",0.07139,0.07139,0.07139,0.0,2,1,1,0,0.071394,,,,,,,,,,,,,,,,,,,,,,,,,,With,Climax,Climax,2,2,NV,Traveling,Resting,Traveling,HG,60
150,151,EAC,Budongo,Sonso,MS,14.12.19,"3784 14/12/2019 11;40, HW MS unk group ph drum resting AB 80.WAV",0.11788,0.11788,0.11788,0.0,2,1,1,0,0.117883,,,,,,,,,,,,,,,,,,,,,,,,,,With,Unk,Unk,0,0,Unk because overlap with other calls,Resting,Resting,Resting,AB,80
151,152,EAC,Budongo,Sonso,HW,14.12.19,"3784 14/12/2019 11;40, HW MS unk group ph drum resting AB 80.WAV",0.09132,0.09132,0.09132,0.0,2,1,1,0,0.091317,,,,,,,,,,,,,,,,,,,,,,,,,,With,Unk,Unk,0,0,Unk because overlap with other calls,Resting,Resting,Resting,AB,80
152,153,EAC,Budongo,Sonso,MS,14.12.19,"3785 14/12/2019 11;42, MS SM JS unk group ph drum (MS drummed) resting AB 80, MB pg.WAV",0.15275,0.15275,0.15275,0.0,2,1,1,0,0.152749,,,,,,,,,,,,,,,,,,,,,,,,,,With,Roar,Roar,1,1,"Ph roar (like BUp), No climax",Resting,Resting,Resting,AB,80
153,154,EAC,Budongo,Sonso,SM,18.12.19,"3838 18/12/2019 09;00, 7;45 JS single ph other party, 9;10 JS single ph drum 50m, 10;40 JS single ph drum, 29;30 HW SM display drum CZE 50.WAV",0.34203,0.34203,0.34203,0.0,3,2,2,0,0.10294,0.239086,,,,,,,,,,,,,,,,,,,,,,,,,Without,0,0,0,0,NV,Display,Display,Display,CZE,50
154,155,EAC,Budongo,Sonso,HW,19.12.19,"3848 19/12/2019 10;03, HW single ph drum traveling FVR 60, KS single ph-bark.WAV",0.18596,0.18596,0.18596,0.0,3,2,2,0,0.109581,0.076375,,,,,,,,,,,,,,,,,,,,,,,,,With,Build-Up,Build-Up,1,1,No Climax,Traveling,Traveling,Traveling,NV,NV
155,156,EAC,Budongo,Sonso,FK,23.12.19,"3868 23/12/2019 09;31, FK single ph drum feeding-resting CYA 50.WAV",1.21867,1.21867,1.21867,0.0,5,4,4,0,0.069733,0.650845,0.391835,0.10626,,,,,,,,,,,,,,,,,,,,,,,With,Roar,Roar,1,1,"Ph roar, No Climax",Feeding,Resting,Resting,CYA,50
156,157,EAC,Budongo,Sonso,FK,23.12.19,"3870 23/12/2019 10;13, FK scream, MS FK group ph drum, FK MS group fg, FK MS group ph drum (resting-AFT) CZE 30, MS FK fg, MS single ph intro, FK MS group ph. FK fg, 3;19 MS FK group ph feeding, 4;24 FK single ph.WAV",0.07638,0.07638,0.07638,0.0,2,1,1,0,0.076375,,,,,,,,,,,,,,,,,,,,,,,,,,With,Climax,Climax,2,2,NV,Resting,AFT,AFT,CZE,30
157,158,EAC,Budongo,Sonso,FK,23.12.19,"3872 23/12/2019 10;42, MS FK group ph drum traveling, MS FK group ph, FK scream, MS fg, 1;22 FK pg scream, pant (video).WAV",0.0,0.0,0.0,0.0,1,0,0,0,0.0,,,,,,,,,,,,,,,,,,,,,,,,,,With,Build-Up,Build-Up,1,1,NV,Traveling,Traveling,Traveling,NV,NV
158,159,EAC,Budongo,Sonso,HW,27.12.19,"3878 27/12/2019 07;22, KT HW unk_f group ph drum traveling-resting CZE 40, 1;15 KT rest hoo.WAV",0.09298,0.09298,0.09298,0.0,2,1,1,0,0.092978,,,,,,,,,,,,,,,,,,,,,,,,,,With,Build-Up,Build-Up,1,1,NV,Traveling,Resting,Traveling,CZE,40
159,160,EAC,Budongo,Sonso,KT,27.12.19,"3881 27/12/2019 08,21, HW KX KT group ph drum (HW and KT ph drum) CZE 50 Albisia 120.WAV",0.32542,0.32542,0.32542,0.0,2,1,1,0,0.325422,,,,,,,,,,,,,,,,,,,,,,,,,,With,Unk,Unk,0,0,Unk because overlap with other calls,Traveling,Resting,Traveling,Albisia,120
160,161,EAC,Budongo,Sonso,HW,27.12.19,"3883 27/12/2019 08;31, HW KX KT group ph drum resting (HW drummed).WAV",0.08472,0.08472,0.08472,0.0,2,1,1,0,0.084723,,,,,,,,,,,,,,,,,,,,,,,,,,With,Climax,Climax,2,2,NV,Resting,Resting,Resting,NV,NV
161,162,EAC,Budongo,Sonso,HW,27.12.19,"3884 27/12/2019 08;38, HW KT KX group ph drum traveling (HW and KT drummed CZE 40).WAV",0.07305,0.07305,0.07305,0.0,2,1,1,0,0.073054,,,,,,,,,,,,,,,,,,,,,,,,,,With,Unk,Unk,0,0,Unk because overlap with other calls,Traveling,Traveling,Traveling,CZE,40
162,163,EAC,Budongo,Sonso,KT,27.12.19,"3884 27/12/2019 08;38, HW KT KX group ph drum traveling (HW and KT drummed CZE 40).WAV",0.08634,0.08634,0.08634,0.0,2,1,1,0,0.086337,,,,,,,,,,,,,,,,,,,,,,,,,,With,Unk,Unk,0,0,Unk because overlap with other calls,Traveling,Traveling,Traveling,CZE,40
163,164,EAC,Budongo,Sonso,JS,27.12.19,"3900 27/12/2019 11;10, JS single ph drum resting-traveling CYA 80.WAV",0.80027,0.80027,0.80027,0.0,5,4,4,0,0.122864,0.488133,0.10294,0.086337,,,,,,,,,,,,,,,,,,,,,,,With,Build-Up,Climax,1,2,NV,Resting,Traveling,Traveling,CYA,80
164,165,EAC,Budongo,Sonso,HW,27.12.19,"3903 27/12/2019 11;46, HW single ph drum traveling FVR 60.WAV",0.0797,0.0797,0.0797,0.0,2,1,1,0,0.079695,,,,,,,,,,,,,,,,,,,,,,,,,,With,Build-Up,Build-Up,1,1,"Ph roar, No climax",Traveling,Traveling,Traveling,FVR,60
165,166,EAC,Budongo,Sonso,HW,27.12.19,"3904 27/12/2019 11;48, HW single ph drum traveling-resting CP 70.WAV",0.08302,0.08302,0.08302,0.0,2,1,1,0,0.083016,,,,,,,,,,,,,,,,,,,,,,,,,,With,Climax,Climax,2,2,NV,Traveling,Resting,Traveling,CP,70
166,167,EAC,Budongo,Sonso,HW,27.12.19,"3905 27/12/2019 11;58, HW PS group ph drum CYA 50.WAV",0.0797,0.0797,0.0797,0.0,2,1,1,0,0.079695,,,,,,,,,,,,,,,,,,,,,,,,,,With,Build-Up,Build-Up,1,1,NV,Traveling,Resting,Traveling,CYA,50
167,168,EAC,Budongo,Sonso,MS,30.12.19,"3914 30/12/2019 05;51, MS single ph drum display to PS, PS rest hoo.WAV",0.10626,0.10626,0.10626,0.0,2,1,1,0,0.10626,,,,,,,,,,,,,,,,,,,,,,,,,,Without,0,0,0,0,NV,Display,Display,Display,NV,NV
168,169,EAC,Budongo,Sonso,MS,30.12.19,"3914 30/12/2019 05;51, MS single ph drum display to PS, PS rest hoo.WAV",0.04649,0.04649,0.04649,0.0,2,1,1,0,0.046489,,,,,,,,,,,,,,,,,,,,,,,,,,Without,0,0,0,0,NV,Display,Display,Display,NV,NV
169,170,EAC,Budongo,Sonso,MS,30.12.19,"3914 30/12/2019 05;51, MS single ph drum display to PS, PS rest hoo.WAV",0.42504,0.42504,0.42504,0.0,3,2,2,0,0.119543,0.179314,0.126184,,,,,,,,,,,,,,,,,,,,,,,,Without,0,0,0,0,NV,Display,Display,Display,NV,NV
170,171,EAC,Budongo,Sonso,MS,30.12.19,"3914 30/12/2019 05;51, MS single ph drum display to PS, PS rest hoo.WAV",0.611,0.611,0.611,0.0,2,1,1,0,0.610997,,,,,,,,,,,,,,,,,,,,,,,,,,Without,0,0,0,0,NV,Display,Display,Display,NV,NV
171,172,EAC,Budongo,Sonso,HW,30.12.19,"3921 30/12/2019 07;14, HW MS group ph drum traveling FP 100.WAV",0.1129,0.1129,0.1129,0.0,2,1,1,0,0.112902,,,,,,,,,,,,,,,,,,,,,,,,,,With,Unk,Unk,0,0,NV,Traveling,Traveling,Traveling,FP,100
172,173,EAC,Budongo,Sonso,HW,04.01.20,"3951 04/01/2020 06;05, HW MB JS unk group ph drum resting FPO 80.WAV",1.07589,1.07589,1.07589,0.0,4,3,3,0,0.282254,0.089657,0.703975,,,,,,,,,,,,,,,,,,,,,,,,With,Unk,Unk,0,0,Unk because overlap with other calls,Resting,Resting,Resting,FPO,80
173,174,EAC,Budongo,Sonso,FK,04.01.20,"3954 04/01/2020 07;12, FK single ph drum traveling CYA 50.WAV",0.06309,0.06309,0.06309,0.0,2,1,1,0,0.063092,,,,,,,,,,,,,,,,,,,,,,,,,,With,Build-Up,Build-Up,1,1,NV,Traveling,Traveling,Traveling,CYA,50
174,175,EAC,Budongo,Sonso,HW,NV,ASO1613 HW single ph drum traveling.WAV,2.76277,2.76277,2.76277,0.0,9,8,8,0,0.162711,0.192597,0.10626,0.252368,0.47153,0.710616,0.092978,0.773708,,,,,,,,,,,,,,,,,,,With,Build-Up,Build-Up,1,1,NV,Traveling,Traveling,Traveling,NV,NV
175,176,EAC,Budongo,Sonso,HW,04.01.20,"3956 04/01/2020 07;40, KT scream, HW single ph drum display, 4;30 unk group ph.WAV",2.26467,2.26467,2.26467,0.0,4,3,3,0,0.664127,1.401308,0.199238,,,,,,,,,,,,,,,,,,,,,,,,Without,0,0,0,0,NV,Display,Display,Display,NV,NV
176,177,EAC,Budongo,Sonso,MS,06.01.20,"3981 06/01/2020 10;25, MS single ph drum traveling CYA 50.WAV",0.29554,0.29554,0.29554,0.0,4,3,3,0,0.072224,0.114562,0.108751,,,,,,,,,,,,,,,,,,,,,,,,With,Climax,Climax,2,2,NV,Traveling,Traveling,Traveling,CYA,50
177,178,EAC,Budongo,Sonso,MS,06.01.20,"3983 06/01/2020 10;41, MS single ph drum traveling, KX scream.WAV",0.06226,0.06226,0.06226,0.0,2,1,1,0,0.062262,,,,,,,,,,,,,,,,,,,,,,,,,,With,Let-Down,Let-Down,3,3,NV,Traveling,Traveling,Traveling,NV,NV
178,179,EAC,Budongo,Sonso,KT,09.01.20,"4028 09/01/2020 13;56, KT display drum to HT and OK CMI 60, OK pg.WAV",0.0,0.0,0.0,0.0,1,0,0,0,,,,,,,,,,,,,,,,,,,,,,,,,,,Without,0,0,0,0,NV,Display,Display,Display,CMI,60
179,180,EAC,Budongo,Sonso,KT,10.01.20,"4039 10/01/2020 07;25, MB single ph start display to IN, KT display drum CYA 80, 11;15 KT unk MB rest hoo.WAV",0.10626,0.10626,0.10626,0.0,2,1,1,0,0.10626,,,,,,,,,,,,,,,,,,,,,,,,,,Without,0,0,0,0,NV,Display,Display,Display,NV,NV
180,181,EAC,Budongo,Sonso,KT,10.01.20,"4039 10/01/2020 07;25, MB single ph start display to IN, KT display drum CYA 80, 11;15 KT unk MB rest hoo.WAV",0.76043,0.76043,0.76043,0.0,4,3,3,0,0.089657,0.551225,0.119543,,,,,,,,,,,,,,,,,,,,,,,,Without,0,0,0,0,NV,Display,Display,Display,NV,NV
181,182,EAC,Budongo,Sonso,KT,10.01.20,"4039 10/01/2020 07;25, MB single ph start display to IN, KT display drum CYA 80, 11;15 KT unk MB rest hoo.WAV",0.09962,0.09962,0.09962,0.0,2,1,1,0,0.099619,,,,,,,,,,,,,,,,,,,,,,,,,,Without,0,0,0,0,NV,Display,Display,Display,NV,NV
182,183,EAC,Budongo,Sonso,KT,10.01.20,"4056 10/01/2020 10;09, KT display drum, stranger_f pg to KT.WAV",0.05712,0.05712,0.05712,0.0,2,1,1,0,0.057121,,,,,,,,,,,,,,,,,,,,,,,,,,Without,0,0,0,0,NV,Display,Display,Display,NV,NV
183,184,EAC,Budongo,Sonso,KT,10.01.20,"4056 10/01/2020 10;09, KT display drum, stranger_f pg to KT.WAV",0.08136,0.08136,0.08136,0.0,2,1,1,0,0.081356,,,,,,,,,,,,,,,,,,,,,,,,,,Without,0,0,0,0,NV,Display,Display,Display,NV,NV
184,185,EAC,Budongo,Sonso,HW,10.01.20,"4059 10/01/2020 11;42, HW JS unk group ph drum resting CAL 60.WAV",0.05728,0.05728,0.05728,0.0,2,1,1,0,0.057281,,,,,,,,,,,,,,,,,,,,,,,,,,Unk,Unk,Unk,0,0,Unk because overlap with other calls,Resting,Resting,Resting,CAL,60
185,186,EAC,Budongo,Sonso,JS,10.01.20,"4065 10/01/2020 12;15, JS HW ph drum rest (JS AB70 & TRP50), 1;10 JS HW ph drum rest JS TRP50, 2;20 JS HW group ph drum rest (JS AB70), JS single ph drum trav CZE 30, MK pg, KU DL MK group ph start, 8;15 unk single ph, JS ph display drum CYA110.WAV",1.55406,1.55406,1.55406,0.0,4,3,3,0,0.073054,1.20207,0.278933,,,,,,,,,,,,,,,,,,,,,,,,With,Climax,Climax,2,2,NV,Resting,Resting,Resting,AB,70
186,187,EAC,Budongo,Sonso,JS,10.01.20,"4065 10/01/2020 12;15, JS HW ph drum rest (JS AB70 & TRP50), 1;10 JS HW ph drum rest JS TRP50, 2;20 JS HW group ph drum rest (JS AB70), JS single ph drum trav CZE 30, MK pg, KU DL MK group ph start, 8;15 unk single ph, JS ph display drum CYA110.WAV",0.75711,0.75711,0.75711,0.0,4,3,3,0,0.078035,0.405118,0.273952,,,,,,,,,,,,,,,,,,,,,,,,Unk,Unk,Unk,0,0,Unk because overlap with other calls,Resting,Resting,Resting,TRP,50
187,188,EAC,Budongo,Sonso,JS,10.01.20,"4065 10/01/2020 12;15, JS HW ph drum rest (JS AB70 & TRP50), 1;10 JS HW ph drum rest JS TRP50, 2;20 JS HW group ph drum rest (JS AB70), JS single ph drum trav CZE 30, MK pg, KU DL MK group ph start, 8;15 unk single ph, JS ph display drum CYA110.WAV",0.1926,0.1926,0.1926,0.0,2,1,1,0,0.192597,,,,,,,,,,,,,,,,,,,,,,,,,,With,Build-Up,Build-Up,1,1,NV,Resting,Resting,Resting,TRP,50
188,189,EAC,Budongo,Sonso,JS,10.01.20,"4065 10/01/2020 12;15, JS HW ph drum rest (JS AB70 & TRP50), 1;10 JS HW ph drum rest JS TRP50, 2;20 JS HW group ph drum rest (JS AB70), JS single ph drum trav CZE 30, MK pg, KU DL MK group ph start, 8;15 unk single ph, JS ph display drum CYA110.WAV",0.16603,0.16603,0.16603,0.0,2,1,1,0,0.166032,,,,,,,,,,,,,,,,,,,,,,,,,,With,Climax,Climax,2,2,NV,Resting,Resting,Resting,AB,70
189,190,EAC,Budongo,Sonso,JS,10.01.20,"4065 10/01/2020 12;15, JS HW ph drum rest (JS AB70 & TRP50), 1;10 JS HW ph drum rest JS TRP50, 2;20 JS HW group ph drum rest (JS AB70), JS single ph drum trav CZE 30, MK pg, KU DL MK group ph start, 8;15 unk single ph, JS ph display drum CYA110.WAV",0.40183,0.40183,0.40183,0.0,3,2,2,0,0.194285,0.20754,,,,,,,,,,,,,,,,,,,,,,,,,With,Build-Up,Build-Up,1,1,NV,Traveling,Traveling,Traveling,CZE,30
190,191,EAC,Budongo,Sonso,JS,10.01.20,"4065 10/01/2020 12;15, JS HW ph drum rest (JS AB70 & TRP50), 1;10 JS HW ph drum rest JS TRP50, 2;20 JS HW group ph drum rest (JS AB70), JS single ph drum trav CZE 30, MK pg, KU DL MK group ph start, 8;15 unk single ph, JS ph display drum CYA110.WAV",0.25237,0.25237,0.25237,0.0,2,1,1,0,0.252368,,,,,,,,,,,,,,,,,,,,,,,,,,Without,0,0,0,0,NV,Display,Display,Display,CYA,110
191,192,EAC,Budongo,Sonso,MB,10.01.20,"4074 10/01/2020 07;04, MB display drum KA 50.WAV",0.0,0.0,0.0,0.0,1,0,0,0,,,,,,,,,,,,,,,,,,,,,,,,,,,Without,0,0,0,0,NV,Display,Display,Display,KA,50
192,193,EAC,Budongo,Sonso,HW,10.01.20,"4078 10/01/2020 07;33, HW display drum.WAV",0.06641,0.06641,0.06641,0.0,2,1,1,0,0.066413,,,,,,,,,,,,,,,,,,,,,,,,,,Without,0,0,0,0,NV,Display,Display,Display,NV,NV
193,194,EAC,Budongo,Sonso,JS,10.01.20,"4082 10/01/2020 08;29, JS display drum, strange_f pg to JS, KX pg to JS.WAV",0.11954,0.11954,0.11954,0.0,2,1,1,0,0.119543,,,,,,,,,,,,,,,,,,,,,,,,,,Without,0,0,0,0,NV,Display,Display,Display,NV,NV
194,195,EAC,Budongo,Sonso,JS,10.01.20,"4082 10/01/2020 08;29, JS display drum, strange_f pg to JS, KX pg to JS.WAV",0.09962,0.09962,0.09962,0.0,2,1,1,0,0.099619,,,,,,,,,,,,,,,,,,,,,,,,,,Without,0,0,0,0,NV,Display,Display,Display,NV,NV
195,196,EAC,Budongo,Sonso,JS,10.01.20,"4082 10/01/2020 08;29, JS display drum, strange_f pg to JS, KX pg to JS.WAV",0.43832,0.43832,0.43832,0.0,3,2,2,0,0.116222,0.3221021,,,,,,,,,,,,,,,,,,,,,,,,,Without,0,0,0,0,NV,Display,Display,Display,NV,NV
196,197,EAC,Budongo,Sonso,JS,10.01.20,"4082 10/01/2020 08;29, JS display drum, strange_f pg to JS, KX pg to JS.WAV",0.0,0.0,0.0,0.0,1,0,0,0,,,,,,,,,,,,,,,,,,,,,,,,,,,Without,0,0,0,0,NV,Display,Display,Display,NV,NV
197,198,EAC,Budongo,Sonso,JS,10.01.20,"4082 10/01/2020 08;29, JS display drum, strange_f pg to JS, KX pg to JS.WAV",0.27229,0.27229,0.27229,0.0,2,1,1,0,0.272292,,,,,,,,,,,,,,,,,,,,,,,,,,Without,0,0,0,0,NV,Display,Display,Display,NV,NV
198,199,EAC,Budongo,Sonso,JS,10.01.20,"4082 10/01/2020 08;29, JS display drum, strange_f pg to JS, KX pg to JS.WAV",0.0,0.0,0.0,0.0,1,0,0,0,,,,,,,,,,,,,,,,,,,,,,,,,,,Without,0,0,0,0,NV,Display,Display,Display,NV,NV
199,200,EAC,Budongo,Sonso,JS,10.01.20,"4082 10/01/2020 08;29, JS display drum, strange_f pg to JS, KX pg to JS.WAV",0.31878,0.31878,0.31878,0.0,2,1,1,0,0.318781,,,,,,,,,,,,,,,,,,,,,,,,,,Without,0,0,0,0,NV,Display,Display,Display,NV,NV
200,201,EAC,Budongo,Sonso,KT,11.01.20,"4087 11/01/2020 11;39, KX strange_f scream, KS display drum CYA 60, 2;00 stranger_f KX group ph, stranger_f single ph, 3;00 group pg-ph, 4;00 unk MI group ph, 5;20 KT display drum, 6;00 KT single ph display (CYA 60, CLP 40).WAV",0.74714,0.74714,0.74714,0.0,3,2,2,0,0.564508,0.182635,,,,,,,,,,,,,,,,,,,,,,,,,Without,0,0,0,0,NV,Display,Display,Display,CYA,60
201,202,EAC,Budongo,Sonso,KT,11.01.20,"4087 11/01/2020 11;39, KX strange_f scream, KS display drum CYA 60, 2;00 stranger_f KX group ph, stranger_f single ph, 3;00 group pg-ph, 4;00 unk MI group ph, 5;20 KT display drum, 6;00 KT single ph display (CYA 60, CLP 40).WAV",0.0,0.0,0.0,0.0,1,0,0,0,,,,,,,,,,,,,,,,,,,,,,,,,,,Without,0,0,0,0,NV,Display,Display,Display,CLP,40
202,203,EAC,Budongo,Sonso,KS,13.01.20,"4120 13/01/2020 12;34, KS display drum, unk_f scream bark, 2;45 KS drum display while traveling CPR 60.WAV",0.19924,0.19924,0.19924,0.0,3,2,2,0,0.131165,0.068073,,,,,,,,,,,,,,,,,,,,,,,,,Without,0,0,0,0,NV,Display,Display,Display,NV,NV
203,204,EAC,Budongo,Sonso,KS,13.01.20,"4120 13/01/2020 12;34, KS display drum, unk_f scream bark, 2;45 KS drum display while traveling CPR 60.WAV",0.04295,0.04295,0.04295,0.0,2,1,1,0,0.042949,,,,,,,,,,,,,,,,,,,,,,,,,,Without,0,0,0,0,NV,Display,Display,Display,CPR ,60
204,205,EAC,Budongo,Sonso,MB,15.01.20,"4169 15/01/2020 07;04, MB display drum.WAV",0.0,0.0,0.0,0.0,1,0,0,0,,,,,,,,,,,,,,,,,,,,,,,,,,,Without,0,0,0,0,NV,Display,Display,Display,NV,NV
205,206,EAC,Budongo,Sonso,MB,15.01.20,"4169 15/01/2020 07;04, MB display drum.WAV",0.0,0.0,0.0,0.0,1,0,0,0,,,,,,,,,,,,,,,,,,,,,,,,,,,Without,0,0,0,0,NV,Display,Display,Display,NV,NV
206,207,EAC,Budongo,Sonso,MB,15.01.20,"4171 15/01/2020 07;09, MB display drum.WAV",0.0,0.0,0.0,0.0,1,0,0,0,,,,,,,,,,,,,,,,,,,,,,,,,,,Without,0,0,0,0,NV,Display,Display,Display,NV,NV
207,208,EAC,Budongo,Sonso,FK,15.01.20,"4179 15/01/2020 08;46, FK display drum.WAV",0.63092,0.63092,0.63092,0.0,3,2,2,0,0.099619,0.531302,,,,,,,,,,,,,,,,,,,,,,,,,Without,0,0,0,0,NV,Display,Display,Display,NV,NV
208,209,EAC,Budongo,Sonso,KT,15.01.20,"4191 15/01/2020 10;22, 3;30 KT display drum to KX, JS single ph display B-U (not visible), 7;40 KT display.WAV",0.0,0.0,0.0,0.0,1,0,0,0,,,,,,,,,,,,,,,,,,,,,,,,,,,Without,0,0,0,0,NV,Display,Display,Display,NV,NV
209,210,EAC,Budongo,Sonso,KS,19.01.20,"4219 19/01/2020 08;57, KS display drum.WAV",0.0963,0.0963,0.0963,0.0,2,1,1,0,0.096298,,,,,,,,,,,,,,,,,,,,,,,,,,Without,0,0,0,0,NV,Display,Display,Display,NV,NV
210,211,EAC,Budongo,Sonso,KS,19.01.20,"4219 19/01/2020 08;57, KS display drum.WAV",0.11709,0.11709,0.11709,0.0,2,1,1,0,0.117085,,,,,,,,,,,,,,,,,,,,,,,,,,Without,0,0,0,0,NV,Display,Display,Display,NV,NV
211,212,EAC,Budongo,Sonso,HW,20.01.20,"4232 20/01/2020 05;57, HW PS group ph bark drum traveling AB 60.WAV",0.10626,0.10626,0.10626,0.0,2,1,1,0,0.10626,,,,,,,,,,,,,,,,,,,,,,,,,,Unk,Unk,Unk,0,0,Unk because overlap with other calls,Feeding,Traveling,Traveling,AB,60
212,213,EAC,Budongo,Sonso,HW,20.01.20,"4234 20/01/2020 06;03, HW JS group ph drum traveling, JS single ph B-U, JS single ph drum traveling KA 50.WAV_TextGrid",0.05977,0.05977,0.05977,0.0,2,1,1,0,0.059771,,,,,,,,,,,,,,,,,,,,,,,,,,With,Build-Up,Build-Up,1,1,NV,Traveling,Traveling,Traveling,NV,NV
213,214,EAC,Budongo,Sonso,JS,20.01.20,"4234 20/01/2020 06;03, HW JS group ph drum traveling, JS single ph B-U, JS single ph drum traveling KA 50.WAV_TextGrid",0.09962,0.09962,0.09962,0.0,2,1,1,0,0.099619,,,,,,,,,,,,,,,,,,,,,,,,,,With,Climax,Climax,2,2,NV,Traveling,Traveling,Traveling,KA,50
214,215,EAC,Budongo,Sonso,JS,20.01.20,"4240 20/01/2020 06;46, 1;30 JS single ph drum traveling FSU 70.WAV",0.1129,0.1129,0.1129,0.0,2,1,1,0,0.112902,,,,,,,,,,,,,,,,,,,,,,,,,,With,Build-Up,Build-Up,1,1,NV,Traveling,Traveling,Traveling,FSU,70
215,216,EAC,Budongo,Sonso,PS,20.01.20,"4256 20/01/2020 08;17, KY pg to PS, PS single ph display drum CYA 50, 2;20 PS single ph drum traveling CYA 70.WAV",0.93974,0.93974,0.93974,0.0,8,7,7,0,0.122864,0.15939,0.172673,0.04981,0.219162,0.099619,0.116222,,,,,,,,,,,,,,,,,,,,With,Unk,Unk,0,0,Unk because overlap with other calls,Display,Display,Display,CYA,50
216,217,EAC,Budongo,Sonso,PS,20.01.20,"4256 20/01/2020 08;17, KY pg to PS, PS single ph display drum CYA 50, 2;20 PS single ph drum traveling CYA 70.WAV",0.94188,0.94188,0.94188,0.0,5,4,4,0,0.159552,0.22559,0.268403,0.288334,,,,,,,,,,,,,,,,,,,,,,,With,Climax,Climax,2,2,NV,Traveling,Traveling,Traveling,CYA,70
217,218,EAC,Budongo,Sonso,SM,20.01.20,"4258 20/01/2020 08;30, SM PS group ph drum approaching (SM), 2;00 PS HW SM JL group ph.WAV",0.85165,0.85165,0.85165,0.0,3,2,2,0,0.084585,0.767067,,,,,,,,,,,,,,,,,,,,,,,,,With,Build-Up,Unk,1,1,Unk because overlap with other calls,Traveling,Traveling,Traveling,NV,NV
218,219,EAC,Budongo,Sonso,HW,20.01.20,"4265 20/01/2020 09;22, HW KT FK group ph drum traveling-resting, HW single ph drum resting during travel, group ph 50m, SM FK unk group ph drum.WAV",0.06475,0.06475,0.06475,0.0,2,1,1,0,0.064752,,,,,,,,,,,,,,,,,,,,,,,,,,With,Unk,Unk,0,0,Unk because overlap with other calls,Traveling,Resting,Traveling,NV,90
219,220,EAC,Budongo,Sonso,HW,20.01.20,"4265 20/01/2020 09;22, HW KT FK group ph drum traveling-resting, HW single ph drum resting during travel, group ph 50m, SM FK unk group ph drum.WAV",0.71394,0.71394,0.71394,0.0,3,2,2,0,0.089657,0.624279,,,,,,,,,,,,,,,,,,,,,,,,,With,Build-Up,Build-Up,1,1,NV,Resting,Resting,Resting,NV,90
220,221,EAC,Budongo,Sonso,HW,20.01.20,"4266 20/01/2020 09;23, HW KT group ph drum traveling CMI.WAV",0.09962,0.09962,0.09962,0.0,2,1,1,0,0.099619,,,,,,,,,,,,,,,,,,,,,,,,,,With,Build-Up,Build-Up,1,1,No Climax,Traveling,Traveling,Traveling,CMI,NV
221,222,EAC,Budongo,Sonso,FK,20.01.20,"4271 20/01/2020 10;21, SM PS IN group ph drum AB 80, 1;50 SM PS group ph drum AB 80, 4;00 PS group ph, 6;40 FK MB PS KT unk group ph, 9;00 SM display drum, 11;00 PS single ph feeding, FK single ph feeding, 17;05 unk single ph.WAV",0.18596,0.18596,0.18596,0.0,2,1,1,0,0.185956,,,,,,,,,,,,,,,,,,,,,,,,,,Without,0,0,0,0,NV,Traveling,AFT,AFT,AB,100
222,223,EAC,Budongo,Sonso,SM,23.01.20,"4292 23/01/2020 06;31 SM FK group ph drum KA 70, 2;25 FK HW group ph drum FK KA 50, FK bark, HW SM display (HW single ph B-U), unk_f scream, 4;00 SM single ph drum display (CMI 40 and KA 80), 13;00 FK HW SM group ph drum (HW rest.WAV",0.0,0.0,0.0,0.0,1,0,0,0,,,,,,,,,,,,,,,,,,,,,,,,,,,Without,0,0,0,0,NV,Display,Display,Display,CMI,40
223,224,EAC,Budongo,Sonso,SM,23.01.20,"4292 23/01/2020 06;31 SM FK group ph drum KA 70, 2;25 FK HW group ph drum FK KA 50, FK bark, HW SM display (HW single ph B-U), unk_f scream, 4;00 SM single ph drum display (CMI 40 and KA 80), 13;00 FK HW SM group ph drum (HW rest.WAV",0.0,0.0,0.0,0.0,1,0,0,0,,,,,,,,,,,,,,,,,,,,,,,,,,,With,Build-Up,Build-Up,1,1,NV,Display,Display,Display,KA,80
224,225,EAC,Budongo,Sonso,SM,23.01.20,4293 23/01/2020 06;34 FK SM group ph drum resting-traveling-resting (both KA 60).WAV,0.0,0.0,0.0,0.0,1,0,0,0,,,,,,,,,,,,,,,,,,,,,,,,,,,With,Unk,Unk,0,0,Unk because overlap with other calls,Resting,Traveling,Traveling,KA,60
225,226,EAC,Budongo,Sonso,SM,23.01.20,4299 23/01/2020 07;09 SM single ph drum traveling FPO 60.WAV,3.73004,3.73004,3.73004,0.0,12,11,11,0,0.083981,0.252368,0.059771,0.192597,0.066413,0.185956,0.099619,0.36527,1.487645,0.285575,0.650845,,,,,,,,,,,,,,,,With,Build-Up,Climax,1,2,NV,Traveling,Traveling,Traveling,FPO,60
226,227,EAC,Budongo,Sonso,HW,23.01.20,"4317 23/01/2020 10;44 HW SM display to unk (not visible), PS display to OK, OK scream, PS scream, 2;35 PS SM HW unk group ph, 3;45 HW display drum.WAV",0.07638,0.07638,0.07638,0.0,2,1,1,0,0.076375,,,,,,,,,,,,,,,,,,,,,,,,,,Without,0,0,0,0,NV,Display,Display,Display,NV,NV
227,228,EAC,Budongo,Sonso,KS,23.01.20,"4321 23/01/2020 11;23 KS display drum KA 80, SM display drum KA 80, unk display.WAV",0.0797,0.0797,0.0797,0.0,2,1,1,0,0.079695,,,,,,,,,,,,,,,,,,,,,,,,,,Without,0,0,0,0,NV,Display,Display,Display,KA,80
228,229,EAC,Budongo,Sonso,KS,23.01.20,"4321 23/01/2020 11;23 KS display drum KA 80, SM display drum KA 80, unk display.WAV",0.09298,0.09298,0.09298,0.0,2,1,1,0,0.092978,,,,,,,,,,,,,,,,,,,,,,,,,,Without,0,0,0,0,NV,Display,Display,Display,KA,80
229,230,EAC,Budongo,Sonso,SM,23.01.20,"4321 23/01/2020 11;23 KS display drum KA 80, SM display drum KA 80, unk display.WAV",0.06641,0.06641,0.06641,0.0,2,1,1,0,0.066413,,,,,,,,,,,,,,,,,,,,,,,,,,Without,0,0,0,0,NV,Display,Display,Display,NV,NV
230,231,EAC,Budongo,Sonso,HW,23.01.20,"4324 23/01/2020 11;29 HW SM group ph drum (HW traveling FSU 40, SM traveling-resting FSU 40).WAV",0.0,0.0,0.0,0.0,1,0,0,0,,,,,,,,,,,,,,,,,,,,,,,,,,,With,Unk,Unk,0,0,Unk because overlap with other calls,Traveling,Traveling,Traveling,FSU,40
231,232,EAC,Budongo,Sonso,SM,23.01.20,"4324 23/01/2020 11;29 HW SM group ph drum (HW traveling FSU 40, SM traveling-resting FSU 40).WAV",0.0,0.0,0.0,0.0,1,0,0,0,,,,,,,,,,,,,,,,,,,,,,,,,,,With,Unk,Unk,0,0,Unk because overlap with other calls,Traveling,Resting,Traveling,FSU,40
232,233,EAC,Budongo,Sonso,JS,28.01.20,4420 28/01/2020 11;52 JS single ph B-U display drum.WAV,0.0,0.0,0.0,0.0,1,0,0,0,,,,,,,,,,,,,,,,,,,,,,,,,,,Without,0,0,0,0,NV,Display,Display,Display,NV,NV
233,234,EAC,Budongo,Sonso,JS,28.01.20,4420 28/01/2020 11;52 JS single ph B-U display drum.WAV,0.0,0.0,0.0,0.0,1,0,0,0,,,,,,,,,,,,,,,,,,,,,,,,,,,Without,0,0,0,0,NV,Display,Display,Display,NV,NV
234,235,EAC,Budongo,Sonso,MS,29.01.20,4435 29/01/2020 07;38 MS single ph drum traveling.WAV,2.47455,2.47455,2.47455,0.0,7,6,6,0,0.156742,0.637562,0.239086,0.275613,0.355308,0.810235,,,,,,,,,,,,,,,,,,,,,With,Build-Up,Climax,1,2,NV,Resting,Traveling,Traveling,NV,NV
235,236,EAC,Budongo,Sonso,MS,29.01.20,"4445 29/01/2020 09;16 KT MS group ph drum traveling (resting), 2;20 KT whimper, MS single ph drum, KT bark.WAV",0.28225,0.28225,0.28225,0.0,2,1,1,0,0.175994,0.10626,,,,,,,,,,,,,,,,,,,,,,,,,With,Climax,Climax,2,2,NV,Resting,Resting,Resting,NV,NV
236,237,EAC,Budongo,Sonso,MS,29.01.20,4453 29/01/2020 10;55 MS MB group ph drum resting.WAV,3.07491,3.07491,3.07491,0.0,4,3,3,0,0.126184,1.467721,1.481003,,,,,,,,,,,,,,,,,,,,,,,,With,Unk,Unk,0,0,Unk because overlap with other calls,Resting,Resting,Resting,NV,NV
237,238,EAC,Budongo,Sonso,MS,29.01.20,4454 29/01/2020 10;58 MS MB group ph drum resting.WAV,2.31521,2.31521,2.31521,0.0,5,4,4,0,0.110306,0.777029,1.30833,0.119543,,,,,,,,,,,,,,,,,,,,,,,With,Build-Up,Unk,1,0,Unk because overlap with other calls,Resting,Resting,Resting,NV,NV
238,239,EAC,Budongo,Sonso,MS,29.01.20,"4461 29/01/2020 11;55 KC PS MS HW group ph, HW MS KC PS group ph drum (MS traveling), PS HW unk group ph.WAV",0.13615,0.13615,0.13615,0.0,2,1,1,0,0.136146,,,,,,,,,,,,,,,,,,,,,,,,,,With,Unk,Unk,0,0,Unk because overlap with other calls,Traveling,Traveling,Traveling,NV,NV
239,240,EAC,Budongo,Sonso,JS,29.01.20,4468 29/01/2020 12;21 JS single ph drum traveling.WAV,0.09398,0.09398,0.09398,0.0,2,1,1,0,0.093977,,,,,,,,,,,,,,,,,,,,,,,,,,With,Build-Up,Build-Up,1,1,No Climax,Traveling,Traveling,Traveling,NV,NV
240,241,EAC,Budongo,Sonso,FK,01.02.20,"4505 01/02/2020 08;48 FK single ph drum traveling CMI 20, 3;30 ZD pg to FK, FK single ph feeding.WAV",0.08634,0.08634,0.08634,0.0,2,1,1,0,0.086337,,,,,,,,,,,,,,,,,,,,,,,,,,With,Build-Up,Build-Up,1,1,NV,Traveling,Traveling,Traveling,CMI,20
241,242,EAC,Budongo,Sonso,MS,01.02.20,"4529 01/02/2020 11;41 MS single ph drum display to FK, unk scream .WAV",0.0963,0.0963,0.0963,0.0,2,1,1,0,0.096298,,,,,,,,,,,,,,,,,,,,,,,,,,With,Build-Up,Build-Up,1,1,"Ph roar (like BUp), No climax",Display,Display,Display,NV,NV
242,243,EAC,Budongo,Sonso,MS,02.02.20,4564 02/02/2020 05;54 MS single ph drum travel COG 30.WAV,0.27893,0.27893,0.27893,0.0,2,1,1,0,0.278933,,,,,,,,,,,,,,,,,,,,,,,,,,With,Climax,Climax,2,2,NV,Traveling,Traveling,Traveling,COG,30
243,244,EAC,Budongo,Sonso,FK,27.02.20,"4567 27/02/2020 06;05 KC display drum (not visible and FP 60), FK SM group ph drum (both traveling KA 80), 1;50 ZL single ph drum travel KA 80.WAV",0.09298,0.09298,0.09298,0.0,2,1,1,0,0.092978,,,,,,,,,,,,,,,,,,,,,,,,,,With,Unk,Unk,0,0,Unk because overlap with other calls,Traveling,Traveling,Traveling,KA,80
244,245,EAC,Budongo,Sonso,SM,27.02.20,"4567 27/02/2020 06;05 KC display drum (not visible and FP 60), FK SM group ph drum (both traveling KA 80), 1;50 ZL single ph drum travel KA 80.WAV",0.80359,0.80359,0.80359,0.0,3,2,2,0,0.079695,0.723898,,,,,,,,,,,,,,,,,,,,,,,,,With,Unk,Unk,0,0,Unk because overlap with other calls,Traveling,Traveling,Traveling,KA,80
245,246,EAC,Budongo,Sonso,ZL,27.02.20,"4567 27/02/2020 06;05 KC display drum (not visible and FP 60), FK SM group ph drum (both traveling KA 80), 1;50 ZL single ph drum travel KA 80.WAV",0.25237,0.25237,0.25237,0.0,3,2,2,0,0.166032,0.086337,,,,,,,,,,,,,,,,,,,,,,,,,With,Climax,Climax,2,2,NV,Traveling,Traveling,Traveling,KA,80
246,247,EAC,Budongo,Sonso,ZL,27.02.20,"4582 27/02/2020 08;44 0;30 ZL display drum CZE 20 and FE 60, 2;00 ZL single ph feeding.WAV",0.0,0.0,0.0,0.0,1,0,0,0,,,,,,,,,,,,,,,,,,,,,,,,,,,Without,0,0,0,0,NV,Display,Display,Display,CZE,20
247,248,EAC,Budongo,Sonso,ZL,27.02.20,"4582 27/02/2020 08;44 0;30 ZL display drum CZE 20 and FE 60, 2;00 ZL single ph feeding.WAV",0.61764,0.61764,0.61764,0.0,5,4,4,0,0.166032,0.15939,0.139467,0.152749,,,,,,,,,,,,,,,,,,,,,,,Without,0,0,0,0,NV,Display,Display,Display,FE,60
248,249,EAC,Budongo,Sonso,PS,27.02.20,"4593 27/02/2020 10;10 PS single ph drum arrived KA 80, ZL single ph intro.WAV",1.43451,1.43451,1.43451,0.0,5,4,4,0,0.152749,0.066413,1.089168,0.126184,,,,,,,,,,,,,,,,,,,,,,,With,Build-Up,Build-Up,1,1,NV,Traveling,Resting,Traveling,KA,80
249,250,EAC,Budongo,Sonso,PS,27.02.20,"4594 27/02/2020 10;13 unk single ph, 1;00 ZL PS group ph drum KA 80 and FM 60 resting.WAV",1.57624,1.57624,1.57624,0.0,4,3,3,0,0.098552,0.212521,1.265162,,,,,,,,,,,,,,,,,,,,,,,,With,Let-Down,Unk,3,0,After LD,Resting,Resting,Resting,KA,80
250,251,EAC,Budongo,Sonso,PS,27.02.20,"4594 27/02/2020 10;13 unk single ph, 1;00 ZL PS group ph drum KA 80 and FM 60 resting.WAV",1.75994,1.75994,1.75994,0.0,9,8,8,0,0.073054,0.305498,0.139467,0.192597,0.059771,0.438324,0.272771,0.278454,,,,,,,,,,,,,,,,,,,Without,0,0,0,0,Continuation of previous drum,Resting,Resting,Resting,FM,60
251,252,EAC,Budongo,Sonso,ZL,27.02.20,4615 27/02/2020 13;09 ZL single ph drum resting BP 60.WAV,0.11954,0.11954,0.11954,0.0,2,1,1,0,0.119543,,,,,,,,,,,,,,,,,,,,,,,,,,With,Build-Up,Build-Up,1,1,NV,Resting,Resting,Resting,BP,60
252,253,EAC,Budongo,Sonso,HW,27.02.20,4617 27/02/2020 13;16 HW ZL group ph drum traveling BP 60.WAV,0.10626,0.10626,0.10626,0.0,2,1,1,0,0.10626,,,,,,,,,,,,,,,,,,,,,,,,,,With,Build-Up,Build-Up,1,1,NV,Traveling,Traveling,Traveling,BP,60
253,254,EAC,Budongo,Sonso,JS,28.02.20,"4634 28/02/2020 07;34 JS display drum FM 70 and CZE 60, JS single ph B-U display, JS single ph drum traveling STD 60.WAV",0.06641,0.06641,0.06641,0.0,2,1,1,0,0.066413,,,,,,,,,,,,,,,,,,,,,,,,,,Without,0,0,0,0,NV,Display,Display,Display,FM,70
254,255,EAC,Budongo,Sonso,JS,28.02.20,"4634 28/02/2020 07;34 JS display drum FM 70 and CZE 60, JS single ph B-U display, JS single ph drum traveling STD 60.WAV",0.09464,0.09464,0.09464,0.0,2,1,1,0,0.094638,,,,,,,,,,,,,,,,,,,,,,,,,,Without,0,0,0,0,NV,Display,Display,Display,CZE,60
255,256,EAC,Budongo,Sonso,SM,28.02.20,4635 28/02/2020 07;38 SM single ph drum display.WAV,1.07069,1.07069,1.07069,0.0,4,3,3,0,0.466333,0.089657,0.514698,,,,,,,,,,,,,,,,,,,,,,,,With,Build-Up,Climax,1,2,NV,Display,Display,Display,NV,NV
256,257,EAC,Budongo,Sonso,KC,28.02.20,4667 28/02/2020 14;06 NB KC KL group ph drum traveling CYA 30.WAV,0.15826,0.15826,0.15826,0.0,2,1,1,0,0.158261,,,,,,,,,,,,,,,,,,,,,,,,,,With,Build-Up,Build-Up,1,1,NV,Display,Display,Display,CYA,30
257,258,EAC,Budongo,Sonso,KC,28.02.20,4667 28/02/2020 14;06 NB KC KL group ph drum traveling CYA 30.WAV,0.0,0.0,0.0,0.0,1,0,0,0,,,,,,,,,,,,,,,,,,,,,,,,,,,With,Build-Up,Build-Up,1,1,NV,Display,Display,Display,NV,NV
258,259,EAC,Budongo,Sonso,KC,28.02.20,"4668 28/02/2020 14;09 KL KC group ph drum (KC FE 30 traveling-resting-AFT), KO scream.WAV",0.19954,0.19954,0.19954,0.0,2,1,1,0,0.199543,,,,,,,,,,,,,,,,,,,,,,,,,,Unk,Unk,Unk,0,0,Unk because overlap with other calls,Traveling,AFT,AFT,FE,30
259,260,EAC,Budongo,Sonso,PS,03.03.20,4690 03/03/2020 14;05 PS display drum KA 80.WAV,2.36097,2.36097,2.36097,0.0,4,3,3,0,0.122864,2.115245,0.122864,,,,,,,,,,,,,,,,,,,,,,,,Without,0,0,0,0,NV,Display,Display,Display,KA,80
260,261,EAC,Budongo,Sonso,MS,03.03.20,"4694 03/03/2020 14;24 MS single ph display drum, MS display, 3;30 KQ juvenile group ph.WAV",0.50474,0.50474,0.50474,0.0,3,2,2,0,0.152749,0.351987,,,,,,,,,,,,,,,,,,,,,,,,,Without,0,0,0,0,NV,Display,Display,Display,FUE,10
261,262,EAC,Budongo,Sonso,MS,03.03.20,"4694 03/03/2020 14;24 MS single ph display drum, MS display, 3;30 KQ juvenile group ph.WAV",1.00283,1.00283,1.00283,0.0,3,2,2,0,0.245727,0.757105,,,,,,,,,,,,,,,,,,,,,,,,,Without,0,0,0,0,NV,Display,Display,Display,KA,80
262,263,EAC,Budongo,Sonso,MS,03.03.20,"4694 03/03/2020 14;24 MS single ph display drum, MS display, 3;30 KQ juvenile group ph.WAV",0.23909,0.23909,0.23909,0.0,2,1,1,0,0.239086,,,,,,,,,,,,,,,,,,,,,,,,,,Without,0,0,0,0,NV,Display,Display,Display,KA,40
263,264,EAC,Budongo,Sonso,MS,03.03.20,"4694 03/03/2020 14;24 MS single ph display drum, MS display, 3;30 KQ juvenile group ph.WAV",0.29222,0.29222,0.29222,0.0,3,2,2,0,0.201361,0.090855,,,,,,,,,,,,,,,,,,,,,,,,,Without,0,0,0,0,NV,Display,Display,Display,NV,NV
264,265,EAC,Budongo,Sonso,MS,05.03.20,"4717 05/03/2020 10;46 PS single ph, FK display (not visible), MS display drum, JN single pg-ph intro.WAV",0.12286,0.12286,0.12286,0.0,2,1,1,0,0.122864,,,,,,,,,,,,,,,,,,,,,,,,,,Without,0,0,0,0,NV,Display,Display,Display,NV,NV
265,266,EAC,Budongo,Sonso,MS,05.03.20,"4717 05/03/2020 10;46 PS single ph, FK display (not visible), MS display drum, JN single pg-ph intro.WAV",0.0,0.0,0.0,0.0,1,0,0,0,,,,,,,,,,,,,,,,,,,,,,,,,,,Without,0,0,0,0,NV,Display,Display,Display,NV,NV
266,267,EAC,Budongo,Sonso,PS,13.03.20,4789 13/03/2020 11;57 PS single ph drum traveling KA 50.WAV,2.14513,2.14513,2.14513,0.0,11,10,10,0,0.166032,0.15939,0.425041,0.192597,0.179314,0.197578,0.307159,0.079695,0.185956,0.252368,,,,,,,,,,,,,,,,,With,Let-Down,Let-Down,3,3,NV,Traveling,Traveling,Traveling,KA,50
267,268,EAC,Budongo,Sonso,KS,16.03.20,"4845 16/03/2020 11;02 0;30 KS display drum, 2;00 KS single ph (display?) to unk_f.WAV",0.77039,0.77039,0.77039,0.0,3,2,2,0,0.073054,0.697333,,,,,,,,,,,,,,,,,,,,,,,,,Without,0,0,0,0,NV,Display,Display,Display,NV,NV
268,269,EAC,Budongo,Sonso,KS,16.03.20,"4845 16/03/2020 11;02 0;30 KS display drum, 2;00 KS single ph (display?) to unk_f.WAV",0.04151,0.04151,0.04151,0.0,2,1,1,0,0.041508,,,,,,,,,,,,,,,,,,,,,,,,,,Without,0,0,0,0,NV,Display,Display,Display,NV,NV
269,270,EAC,Budongo,Sonso,KS,16.03.20,"4845 16/03/2020 11;02 0;30 KS display drum, 2;00 KS single ph (display?) to unk_f.WAV",0.0,0.0,0.0,0.0,1,0,0,0,,,,,,,,,,,,,,,,,,,,,,,,,,,Without,0,0,0,0,NV,Display,Display,Display,NV,NV
270,271,EAC,Budongo,Sonso,ZL,05.07.11,"Budongo 2011-07-05 Clip 25 14;00;21 ZL (KW f., OK)",0.57718,0.57718,0.57718,0.0,7,6,6,0,0.099203,0.128062,0.11724,0.028859,0.147903,0.055914,,,,,,,,,,,,,,,,,,,,,With,Build-Up,Build-Up,1,1,NV,Resting,Traveling,Traveling,NV,NV
271,272,EAC,Budongo,Sonso,ZL,05.07.11,"Budongo 2011-07-05 Clip 25 14;00;21 ZL (KW f., OK)",0.54699,0.54699,0.54699,0.0,4,3,3,0,0.212311,0.208147,0.126532,,,,,,,,,,,,,,,,,,,,,,,,With,Let-Down,Let-Down,3,3,Same call as before but drummed on other tree,Traveling,Traveling,Traveling,NV,NV
272,273,EAC,Budongo,Sonso,FK,02.08.11,Budongo 2011-08-02 Clip 3 08;28;03 FK (NB f.),1.12917,1.12917,1.12917,0.0,5,4,4,0,0.332563,0.042537,0.688327,0.065739,,,,,,,,,,,,,,,,,,,,,,,With,Build-Up,Build-Up,1,1,"Ph roar, No climax",Resting,Resting,Resting,NV,NV
273,274,EAC,Budongo,Sonso,ZL,31.08.11,"Budongo 2011-08-31 Clip 10 10;28;29 ZL, ZD",0.52978,0.52978,0.52978,0.0,5,4,4,0,0.166281,0.058005,0.119877,0.185616,,,,,,,,,,,,,,,,,,,,,,,With,Climax,Climax,2,2,NV,Traveling,Traveling,Traveling,NV,NV
274,275,EAC,Budongo,Sonso,ZL,31.08.11,Budongo 2011-08-31 Clip 25 12;27;01 ZL,0.16984,0.16984,0.16984,0.0,2,1,1,0,0.169839,,,,,,,,,,,,,,,,,,,,,,,,,,With,Let-Down,Let-Down,3,3,NV,Display,Display,Display,NV,NV
275,276,EAC,Budongo,Sonso,ZL,21.06.21,"Budongo 2012-06-21 Clip 32 11;28;44 ZL (WL, ST)",0.86038,0.86038,0.86038,0.0,5,4,4,0,0.366407,0.176418,0.203559,0.113993,,,,,,,,,,,,,,,,,,,,,,,With,Build-Up,Climax,1,2,NV,Traveling,Traveling,Traveling,NV,NV
276,279,EAC,Budongo,Waibira,BEN,03.03.17,"BudongoAS WS 2017-03-03 Clip - 20 17;27;26 BEN, LAF.wav",0.0,0.0,0.0,0.0,1,0,0,0,,,,,,,,,,,,,,,,,,,,,,,,,,,With,Climax,Climax,2,2,NV,NV,NV,AFT,NV,NV
277,280,EAC,Budongo,Waibira,MAC,09.03.17,BudongoAS WS 2017-03-09 Clip - 1 09;36;10 MAC.wav,0.10487,0.10487,0.10487,0.0,2,1,1,0,0.104873,,,,,,,,,,,,,,,,,,,,,,,,,,With,Climax,Climax,2,2,NV,NV,NV,Traveling,NV,NV
278,281,EAC,Budongo,Waibira,MAC,21.04.17,BudongoAS WS 2017-04-21 Clip - 1 09;52;13 MAC.wav,0.0,0.0,0.0,0.0,1,0,0,0,,,,,,,,,,,,,,,,,,,,,,,,,,,With,Climax,Climax,2,2,NV,NV,NV,Display,NV,NV
279,282,EAC,Budongo,Waibira,TRS,27.04.17,BudongoAS WS 2017-04-27 Clip - 3 13;26;06 TRS.wav,1.49196,1.49196,1.49196,0.0,7,6,6,0,0.087762,0.109038,0.194141,0.087762,0.242011,0.771243,,,,,,,,,,,,,,,,,,,,,With,Build-Up,Climax,1,2,NV,NV,NV,Traveling,NV,NV
280,283,EAC,Budongo,Waibira,TRS,27.04.17,BudongoAS WS 2017-04-27 Clip - 11 15;55;22 TRS (FID).wav,1.08445,1.08445,1.08445,0.0,7,6,6,0,0.224404,0.132825,0.172673,0.10294,0.079695,0.371911,,,,,,,,,,,,,,,,,,,,,With,Build-Up,Climax,1,2,NV,NV,NV,Traveling,NV,NV
281,284,EAC,Budongo,Waibira,SAM,10.05.17,BudongoAS WS 2017-05-10 Clip - 17 12;45;19 SAM.wav,0.0,0.0,0.0,0.0,1,0,0,0,,,,,,,,,,,,,,,,,,,,,,,,,,,Without,0,0,0,0,NV,NV,NV,Unk,NV,NV
282,285,EAC,Budongo,Waibira,ALF,16.01.18,Budongo WS 2018-01-16 Clip 11 08;33;35 ALF ph-dr.mov double-beat.wav,0.10201,0.10201,0.10201,0.0,2,1,1,0,0.102005,,,,,,,,,,,,,,,,,,,,,,,,,,With,Climax,Climax,2,2,NV,NV,NV,Unk,NV,NV
283,286,EAC,Budongo,Waibira,ALF,16.01.18,Budongo WS 2018-01-16 Clip 14 09;31;17 ALF ph-dr.mov double-beat,0.0911,0.0911,0.0911,0.0,2,1,1,0,0.091104,,,,,,,,,,,,,,,,,,,,,,,,,,With,Climax,Climax,2,2,NV,NV,NV,Unk,NV,NV
284,287,EAC,Budongo,Waibira,BEN,17.01.18,Budongo WS 2018-01-17 Clip 09 08;06;29 BEN Dr.mov 1+1,0.39548,0.39548,0.39548,0.0,2,1,1,0,0.395478,,,,,,,,,,,,,,,,,,,,,,,,,,Without,0,0,0,0,NV,NV,NV,Unk,NV,NV
285,288,EAC,Budongo,Waibira,TRS,10.01.19,Budongo WS 2019-01-10 Clip 01 09;27;00 TRS ph-dr.wav 5bs.wav,0.96259,0.96259,0.96259,0.0,5,4,4,0,0.154439,0.218293,0.235219,0.354638,,,,,,,,,,,,,,,,,,,,,,,With,Build-Up,Build-Up,1,1,NV,NV,NV,Unk,NV,NV
286,289,EAC,Budongo,Waibira,DAU,11.01.19,Budongo WS 2019-01-11 Clip 05 08;46;00 DAU ph-dr.m4v 1+db+1+db+1.wav,2.04936,2.04936,2.04936,0.0,7,6,6,0,0.25473,0.075782,0.580758,0.321622,0.078527,0.737941,,,,,,,,,,,,,,,,,,,,,With,Climax,Climax,2,2,NV,NV,NV,Unk,CYA,NV
287,290,EAC,Budongo,Waibira,SAM,11.01.19,Budongo WS 2019-01-11 Clip 09 08;49;00 SAM ph-dr.m4v 1+1+1.wav,0.32737,0.32737,0.32737,0.0,3,2,2,0,0.124635,0.202739,,,,,,,,,,,,,,,,,,,,,,,,,With,Climax,Climax,2,2,NV,NV,NV,Unk,CYA,NV
288,291,EAC,Budongo,Waibira,ILA,11.01.19,Budongo WS 2019-01-11 Clip 04 08;41;00 ILA ph-dr.m4v double beat.wav,0.09557,0.09557,0.09557,0.0,2,1,1,0,0.095566,,,,,,,,,,,,,,,,,,,,,,,,,,With,Build-Up,Build-Up,1,1,NV,NV,NV,Unk,CYA,NV
289,292,EAC,Budongo,Waibira,URS,15.01.19,Budongo WS 2019-01-15 Clip 01 08;52;24 URS ph dr.mov double-beat.wav,0.07691,0.07691,0.07691,0.0,2,1,1,0,0.076908,,,,,,,,,,,,,,,,,,,,,,,,,,With,Climax,Climax,2,2,NV,NV,NV,Unk,NV,NV
290,293,EAC,Budongo,Waibira,UNK,05.06.19,Budongo VE 2019-06-05 Clip 144 PH DR approaching feeding tree with BEN?.wav,0.7452,0.7452,0.7452,0.0,6,5,5,0,0.324795,0.089045,0.193992,0.042488,0.094884,,,,,,,,,,,,,,,,,,,,,,With,Unk,Unk,0,0,NV,NV,NV,Unk,NV,NV
291,294,EAC,Budongo,Waibira,TAL,08.06.19,"Budongo VE 2019-06-08 Clip 1 TAL DR, then PH intro (joining feeding tree. BEN is nearby).wav",0.57587,0.57587,0.57587,0.0,4,3,3,0,0.135242,0.21377,0.226858,,,,,,,,,,,,,,,,,,,,,,,,Without,0,0,0,0,NV,NV,NV,Display,NV,NV
292,295,EAC,Budongo,Waibira,TAL,08.06.19,Budongo VE 2019-06-08 Clip 73 TAL came down and DR (display?) .wav,0.74299,0.74299,0.74299,0.0,2,1,1,0,0.74299,,,,,,,,,,,,,,,,,,,,,,,,,,Without,0,0,0,0,NV,NV,NV,Display,NV,NV
293,296,EAC,Budongo,Waibira,ALF,12.06.19,Budongo MH 2019-06-12 Clip 1 ALF? PH-DR,0.34784,0.34784,0.34784,0.0,3,2,2,0,0.233439,0.114397,,,,,,,,,,,,,,,,,,,,,,,,,With,Climax,Climax,2,2,NV,NV,NV,Unk,NV,NV
294,297,EAC,Budongo,Waibira,ALF,12.06.19,Budongo MH 2019-06-12 Clip 2 ALF PH-DR db,0.088,0.088,0.088,0.0,2,1,1,0,0.0879997,,,,,,,,,,,,,,,,,,,,,,,,,,With,Climax,Climax,2,2,NV,NV,NV,Unk,NV,NV
295,298,EAC,Budongo,Waibira,ILA,12.06.19,Budongo MH 2019-06-12 Clip 4 ILA PH-DR db GT to GR,0.08931,0.08931,0.08931,0.0,2,1,1,0,0.089311,,,,,,,,,,,,,,,,,,,,,,,,,,With,Climax,Climax,2,2,NV,NV,NV,Resting,NV,NV
296,299,EAC,Budongo,Waibira,TRS,15.06.19,Budongo VE 2019-06-15 Clip 90 TRS PH-DR complex CYA.wav,0.56429,0.56429,0.56429,0.0,5,4,4,0,0.216352,0.070168,0.171035,0.106738,,,,,,,,,,,,,,,,,,,,,,,With,Climax,Climax,2,2,NV,NV,NV,Unk,CYA,NV
297,300,EAC,Budongo,Waibira,ILA,15.06.19,Budongo VE 2019-06-15 Clip 93 in response to PH ILA PH-DR 2 double beats and TRS joined GT.wav,0.91296,0.91296,0.91296,0.0,4,3,3,0,0.05313,0.786777,0.073054,,,,,,,,,,,,,,,,,,,,,,,,With,Climax,Climax,2,2,NV,NV,NV,Traveling,NV,NV
298,301,EAC,Budongo,Waibira,ALF,15.06.19,Budongo VE 2019-06-15 Clip 66 ALF PH-DR double beat GT.wav,0.07121,0.07121,0.07121,0.0,2,1,1,0,0.071214,,,,,,,,,,,,,,,,,,,,,,,,,,With,Climax,Climax,2,2,NV,NV,NV,Traveling,NV,NV
299,302,EAC,Budongo,Waibira,ALF,15.06.19,Budongo VE 2019-06-15 Clip 105 ALF PH-DR GT.wav,0.08247,0.08247,0.08247,0.0,2,1,1,0,0.082468,,,,,,,,,,,,,,,,,,,,,,,,,,With,Climax,Climax,2,2,NV,NV,NV,Traveling,NV,NV
300,303,EAC,Budongo,Waibira,ALF,15.06.19,Budongo VE 2019-06-15 Clip 116 ALF PH-DR GT.wav,0.0785,0.0785,0.0785,0.0,2,1,1,0,0.078503,,,,,,,,,,,,,,,,,,,,,,,,,,With,Climax,Climax,2,2,NV,NV,NV,Traveling,NV,NV
301,304,EAC,Budongo,Waibira,DAU,15.06.19,Budongo VE 2019-06-15 Clip 17 DAU PH-DR and ILA PH-DR response CYA tree .wav,0.28059,0.28059,0.28059,0.0,2,1,1,0,0.280594,,,,,,,,,,,,,,,,,,,,,,,,,,With,Let-Down,Let-Down,3,3,NV,NV,NV,Unk,NV,NV
302,305,EAC,Budongo,Waibira,ILA,15.06.19,Budongo VE 2019-06-15 Clip 17 DAU PH-DR and ILA PH-DR response CYA tree .wav,0.088,0.088,0.088,0.0,2,1,1,0,0.087997,,,,,,,,,,,,,,,,,,,,,,,,,,With,Build-Up,Build-Up,1,1,NV,NV,NV,Unk,CYA,NV
303,306,EAC,Budongo,Waibira,UNK,15.06.19,Budongo MH 2019-06-15 Clip 3 UNK PH-DR,0.08767,0.08767,0.08767,0.0,2,1,1,0,0.087665,,,,,,,,,,,,,,,,,,,,,,,,,,With,Build-Up,Build-Up,1,1,NV,NV,NV,Unk,NV,NV
304,307,EAC,Budongo,Waibira,MAC,17.06.19,Budongo VE 2019-06-17 Clip 20 MAC PH-DR 3 beats.wav,0.7888,0.7888,0.7888,0.0,3,2,2,0,0.690202,0.098602,,,,,,,,,,,,,,,,,,,,,,,,,With,Climax,Climax,2,2,NV,NV,NV,Unk,NV,NV
305,308,EAC,Budongo,Waibira,DAU,20.06.19,Budongo VE 2019-06-20 Clip 2 BEN PH-DR 3 beats and UNK (DAU?),1.17682,1.17682,1.17682,0.0,5,4,4,0,0.662117,0.182635,0.092978,0.239086,,,,,,,,,,,,,,,,,,,,,,,With,Climax,Climax,2,2,NV,NV,NV,Unk,NV,NV
306,309,EAC,Budongo,Waibira,BEN,20.06.19,Budongo VE 2019-06-20 Clip 1 BEN and DAUDI PH-DRs (3 beats? and 2 beats?) and lots of calls,0.7488,0.7488,0.7488,0.0,4,3,3,0,0.097959,0.345687,0.305158,,,,,,,,,,,,,,,,,,,,,,,,With,Climax,Climax,2,2,NV,NV,NV,Traveling,CMI,NV
307,310,EAC,Budongo,Waibira,BEN,20.06.19,Budongo VE 2019-06-20 Clip 2 BEN PH-DR 3 beats and UNK (DAU?),0.42772,0.42772,0.42772,0.0,3,2,2,0,0.09566,0.332064,,,,,,,,,,,,,,,,,,,,,,,,,With,Climax,Climax,2,2,NV,NV,NV,Traveling,CYA,NV
308,311,EAC,Budongo,Waibira,DAU,20.06.19,Budongo VE 2019-06-20 Clip 1 BEN and DAUDI PH-DRs (4 beats? and 2 beats?) and lots of calls,0.1789,0.1789,0.1789,0.0,2,1,1,0,0.178899,,,,,,,,,,,,,,,,,,,,,,,,,,With,Climax,Climax,2,2,NV,NV,NV,Unk,NV,NV
309,312,EAC,Budongo,Waibira,MAC,23.06.19,2019-06-23 Clip 6 MAC PH-DR 3 beats + 4 single beats (GR to MC).wav,1.43973,1.43973,1.43973,0.0,7,6,6,0,0.119214,0.077044,0.329229,0.330851,0.28544,0.297954,,,,,,,,,,,,,,,,,,,,,With,Climax,Roar,2,3,"Ph roar, roar after climax",NV,NV,Unk,CMI,NV
310,313,EAC,Budongo,Waibira,MAC,23.06.19,2019-06-23 Clip 3 MAC PH-DR 3 beats+ 3 single beats and others PH-re CMI tree.wav,1.04268,1.04268,1.04268,0.0,5,4,4,0,0.074714,0.295537,0.351987,0.320441,,,,,,,,,,,,,,,,,,,,,,,With,Climax,Let-Down,2,3,"Ph roar, roar after climax",NV,NV,Resting,CMI,NV
311,314,EAC,Budongo,Waibira,DAU,23.06.19,2019-06-23 Clip 36 DAU PH-DR 2+2 (GT) tree CYA.wav,0.56678,0.56678,0.56678,0.0,4,3,3,0,0.075441,0.419072,0.072269,,,,,,,,,,,,,,,,,,,,,,,,With,Build-Up,Build-Up,1,1,NV,NV,NV,Traveling,CYA,NV
312,315,EAC,Budongo,Waibira,MAC,23.06.19,"2019-06-23 Clip 2 MAC PH-DR (3 beats) and DR (2 beats) CMI and CAL, others PH-re.wav",0.07423,0.07423,0.07423,0.0,2,1,1,0,0.074229,,,,,,,,,,,,,,,,,,,,,,,,,,With,Climax,Climax,2,2,NV,NV,NV,Unk,CMI,NV
313,316,EAC,Budongo,Waibira,MAC,23.06.19,"2019-06-23 Clip 2 MAC PH-DR (3 beats) and DR (2 beats) CMI and CAL, others PH-re.wav",0.03404,0.03404,0.03404,0.0,2,1,1,0,0.034037,,,,,,,,,,,,,,,,,,,,,,,,,,Without,0,0,0,0,NV,NV,NV,Unk,CAL,NV
314,317,EAC,Budongo,Waibira,MAC,23.06.19,2019-06-23 Clip 12 MAC PH-DR db.wav,0.06729,0.06729,0.06729,0.0,2,1,1,0,0.067289,,,,,,,,,,,,,,,,,,,,,,,,,,With,Climax,Climax,2,2,NV,NV,NV,Unk,CYA,NV
315,318,EAC,Budongo,Waibira,MAC,23.06.19,2019-06-23 Clip 25 MAC PH-DR (GR to GR).wav,0.1041,0.1041,0.1041,0.0,2,1,1,0,0.104104,,,,,,,,,,,,,,,,,,,,,,,,,,With,Pause,Pause,0,0,"Ph roar, pause climax-roar",NV,NV,Resting,NV,NV
316,319,EAC,Budongo,Waibira,MAC,23.06.19,2019-06-23 Clip 27 MAC PH-DR (AFT) 1 beat.wav,0.0,0.0,0.0,0.0,1,0,0,0,,,,,,,,,,,,,,,,,,,,,,,,,,,With,Climax,Climax,2,2,NV,NV,NV,AFT,NV,NV
317,320,EAC,Budongo,Waibira,ALF,26.06.19,2019-06-26 Clip 2 ALF PH-DR db (GT),0.088,0.088,0.088,0.0,2,1,1,0,0.087997,,,,,,,,,,,,,,,,,,,,,,,,,,With,Climax,Climax,2,2,NV,NV,NV,Traveling,NV,NV
318,321,EAC,Budongo,Waibira,ALF,26.06.19,2019-06-26 Clip 5 Multiple PH-DRs but not clear and 1 clear ALF PH-DR db,0.0797,0.0797,0.0797,0.0,2,1,1,0,0.079695,,,,,,,,,,,,,,,,,,,,,,,,,,With,Climax,Climax,2,2,NV,NV,NV,Traveling,CMI,NV
319,322,EAC,Budongo,Waibira,SAM,27.06.19,Budongo VE 2019-06-27 Clip 4 SAM DR 2b (GT-Display?).wav,0.11068,0.11068,0.11068,0.0,2,1,1,0,0.110676,,,,,,,,,,,,,,,,,,,,,,,,,,Without,0,0,0,0,NV,NV,NV,Display,CYA,NV
320,323,EAC,Budongo,Waibira,DAU,03.07.19,Budongo VE 2019-07-03 Clip 7 DAU PH-DR CYA dbh 70.wav,0.32439,0.32439,0.32439,0.0,3,2,2,0,0.042131,0.282254,,,,,,,,,,,,,,,,,,,,,,,,,With,Build-Up,Unk,1,0,NV,NV,NV,Traveling,CYA,70
321,324,EAC,Budongo,Waibira,ALF,03.07.19,Budongo VE 2019-07-03 Clip 2 ALF PH-DR db (GT).wav,0.07417,0.07417,0.07417,0.0,2,1,1,0,0.07417,,,,,,,,,,,,,,,,,,,,,,,,,,With,Climax,Climax,2,2,NV,NV,NV,Traveling,CZE,NV
322,325,EAC,Budongo,Waibira,ILA,08.07.19,Budongo VE 2019-07-08 Clip 16 ILA PH-DR CYA 150dbh GT .wav,0.46087,0.46087,0.46087,0.0,4,3,3,0,0.067715,0.335543,0.057608,,,,,,,,,,,,,,,,,,,,,,,,With,Roar,Roar,1,1,Roar before climax,NV,NV,Traveling,CYA,150
323,326,EAC,Budongo,Waibira,FID,08.07.19,Budongo VE 2019-07-08 Clip 8 FID PH-DR CMI tree 80 diam.wav,0.20422,0.204,0.204,0.0,2,1,1,0,0.204,,,,,,,,,,,,,,,,,,,,,,,,,,With,Let-Down,Let-Down,3,3,NV,NV,NV,Resting,CMI,80
324,327,EAC,Budongo,Waibira,ILA,08.07.19,Budongo VE 2019-07-08 Clip 13 ILA DR display db.wav,0.08221,0.08221,0.08221,0.0,2,1,1,0,0.082214,,,,,,,,,,,,,,,,,,,,,,,,,,Without,0,0,0,0,NV,NV,NV,Display,NV,NV
325,328,EAC,Budongo,Waibira,DAU,11.07.19,Budongo VE 2019-07-11 Clip 11 DAU PH-DR (GT) .wav,0.07688,0.07688,0.07688,0.0,2,1,1,0,0.076876,,,,,,,,,,,,,,,,,,,,,,,,,,With,Climax,Climax,2,2,NV,NV,NV,Traveling,NV,NV
326,329,EAC,Budongo,Waibira,TRS,16.07.19,Budongo VE 2019-07-16 Clip 17 TRS PH-DR (Hands) and SAM PH-DR (Feet) same tree CMI 60 dbh.wav,0.84633,0.84633,0.84633,0.0,6,5,5,0,0.140699,0.126184,0.116222,0.251538,0.21169,,,,,,,,,,,,,,,,,,,,,,With,Unk,Unk,0,0,Unk because overlap with others,NV,NV,Traveling,CMI,60
327,330,EAC,Budongo,Waibira,TRS,16.07.19,Budongo VE 2019-07-16 Clip 18 TRS PH-DR complex and SAM PH-DR 2+1beats (GT or Display?).wav,0.37067,0.37067,0.37067,0.0,4,3,3,0,0.078035,0.099204,0.193427,,,,,,,,,,,,,,,,,,,,,,,,With,Build-Up,Build-Up,1,1,NV,NV,NV,Traveling,CYA,80
328,331,EAC,Budongo,Waibira,DAU,16.07.19,Budongo VE 2019-07-16 Clip 1 DAU? PH-DR 50m (not MAC) .wav,0.13283,0.13283,0.13283,0.0,2,1,1,0,0.132825,,,,,,,,,,,,,,,,,,,,,,,,,,With,Build-Up,Build-Up,1,1,NV,NV,NV,Traveling,NV,NV
329,332,EAC,Budongo,Waibira,SAM,16.07.19,Budongo VE 2019-07-16 Clip 17 TRS PH-DR (Hands) and SAM PH-DR (Feet) same tree CMI 60 dbh.wav,0.06528,0.06528,0.06528,0.0,2,1,1,0,0.06528,,,,,,,,,,,,,,,,,,,,,,,,,,With,Climax,Climax,2,2,NV,NV,NV,Traveling,CMI,60
330,333,EAC,Budongo,Waibira,BEN,20.07.19,Budongo VE 2019-07-20 Clip 36 BEN PH-DR (GT) tree CMU dbh 90.wav,0.75711,0.75711,0.75711,0.0,4,3,3,0,0.105724,0.324177,0.327204,,,,,,,,,,,,,,,,,,,,,,,,With,Climax,Let-Down,2,3,NV,NV,NV,Traveling,CMU,90
331,334,EAC,Budongo,Waibira,BEN,20.07.19,Budongo VE 2019-07-20 Clip 56 BEN PH-DR (GT alone) 2b+1+1b.wav,1.16515,1.16515,1.16515,0.0,4,3,3,0,0.101279,0.324177,0.739694,,,,,,,,,,,,,,,,,,,,,,,,With,Roar,Roar,1,1,"Ph roar, no climax",NV,NV,Traveling,NV,NV
332,335,EAC,Budongo,Waibira,BEN,20.07.19,Budongo VE 2019-07-20 Clip 7 BEN PH-DR (GT).wav,0.39652,0.39652,0.39652,0.0,3,2,2,0,0.101587,0.294929,,,,,,,,,,,,,,,,,,,,,,,,,With,Climax,Climax,2,2,NV,NV,NV,Traveling,NV,NV
333,336,EAC,Budongo,Waibira,BEN,20.07.19,Budongo VE 2019-07-20 Clip 37 BEN PH-DR (GT) tree CYA dbh 70.wav,0.43617,0.43617,0.43617,0.0,3,2,2,0,0.073698,0.362475,,,,,,,,,,,,,,,,,,,,,,,,,With,Climax,Climax,2,2,NV,NV,NV,Traveling,CYA,70
334,337,EAC,Budongo,Waibira,BEN,20.07.19,Budongo VE 2019-07-20 Clip 54 BEN PH-DR (GT alone) 2b+1b CAL dbh 50.wav,0.415,0.415,0.415,0.0,3,2,2,0,0.076402,0.338598,,,,,,,,,,,,,,,,,,,,,,,,,With,Build-Up,Let-Down,1,1,"Ph roar, No climax",NV,NV,Traveling,CAL,50
335,338,EAC,Budongo,Waibira,BEN,20.07.19,Budongo VE 2019-07-20 Clip 34 BEN PH-DR (GT) db+1.wav,0.88823,0.88823,0.88823,0.0,3,2,2,0,0.377914,0.510315,,,,,,,,,,,,,,,,,,,,,,,,,With,Climax,Let-Down,2,3,NV,NV,NV,Traveling,CYA,100
336,339,EAC,Budongo,Waibira,BEN,20.07.19,Budongo VE 2019-07-20 Clip 45 BEN PH-DR (GT to GR?) CMI dbh 80.wav,0.08627,0.08627,0.08627,0.0,2,1,1,0,0.086273,,,,,,,,,,,,,,,,,,,,,,,,,,With,Climax,Climax,2,2,NV,NV,NV,Traveling,CMI,80
337,340,EAC,Budongo,Waibira,BEN,20.07.19,Budongo VE 2019-07-20 Clip 17 BEN PH-DR (GR) tree CAL dbh 30.wav,0.0,0.0,0.0,0.0,1,0,0,0,,,,,,,,,,,,,,,,,,,,,,,,,,,With,Climax,Climax,2,2,NV,NV,NV,Resting,CAL,30
338,341,EAC,Budongo,Waibira,BEN,20.07.19,Budongo VE 2019-07-20 Clip 31 BEN PH-DR (GT) tree CYA dbh 120.wav,0.0,0.0,0.0,0.0,1,0,0,0,,,,,,,,,,,,,,,,,,,,,,,,,,,With,Climax,Climax,2,2,NV,NV,NV,Traveling,CYA,120
339,342,EAC,Budongo,Waibira,BEN,21.07.19,Wai_BEN_Ph-d_LAF joined_travel to rest_CYA_dbh-110_220719_1156.MP3,0.40761,0.40761,0.40761,0.0,2,1,1,0,0.407608,,,,,,,,,,,,,,,,,,,,,,,,,,With,Build-Up,Build-Up,1,1,NV,NV,NV,Unk,CYA,110
340,343,EAC,Budongo,Waibira,BEN,21.07.19,Wai_BEN_Ph-d_Travel to Rest_CYA_210719_0903_alone in party.MP3,0.09132,0.09132,0.09132,0.0,2,1,1,0,0.091317,,,,,,,,,,,,,,,,,,,,,,,,,,With,Roar,Roar,1,1,"Ph roar, No climax",NV,NV,Unk,CYA,NV
341,344,EAC,Budongo,Waibira,ILA,22.07.19,Wai_ILA_Ph-d_2 bouts_1st_CAL_dbh-70_2nd 1min_COM_dbh-40_220719.MP3,0.35945,0.35945,0.35945,0.0,3,2,2,0,0.069733,0.289721,,,,,,,,,,,,,,,,,,,,,,,,,With,Roar,Roar,1,1,"Ph roar, No climax",NV,NV,Unk,COM,40
342,345,EAC,Budongo,Waibira,ILA,22.07.19,Wai_ILA_Ph-d_2 bouts_1st_CAL_dbh-70_2nd 1min_COM_dbh-40_220719.MP3,0.06309,0.06309,0.06309,0.0,2,1,1,0,0.063092,,,,,,,,,,,,,,,,,,,,,,,,,,With,Climax,Climax,2,2,NV,NV,NV,Unk,CAL,70
343,346,EAC,Budongo,Waibira,ILA,22.07.19,Wai_ILA_Ph-d_3 bouts_1st_COM_dbh-50_2nd-3rd_CYA_220719.MP3,0.05687,0.05687,0.05687,0.0,2,1,1,0,0.056866,,,,,,,,,,,,,,,,,,,,,,,,,,With,Unk,Unk,0,0,Unk Climax into wabarks?,NV,NV,Unk,CYA,NV
344,347,EAC,Budongo,Waibira,ILA,22.07.19,Wai_ILA_Ph-d_3 bouts_1st_COM_dbh-50_2nd-3rd_CYA_220719.MP3,0.07139,0.07139,0.07139,0.0,2,1,1,0,0.071394,,,,,,,,,,,,,,,,,,,,,,,,,,Without,0,0,0,0,NV,NV,NV,Unk,CYA,NV
345,348,EAC,Budongo,Waibira,BEN,27.07.19,Budongo VE 2019-07-27 Clip 1 BEN PH-DR and GER MAC joined in the PH CMI dbh 70 (GT).wav,0.468,0.468,0.468,0.0,2,1,1,0,0.467996,,,,,,,,,,,,,,,,,,,,,,,,,,With,Roar,Unk,1,0,Unk because overlap with other calls,NV,NV,Traveling,CMI,70
346,349,EAC,Budongo,Waibira,MAC,17.11.19,chorus_ph-d_171119_02.WAV,0.35329,0.35329,0.35329,0.0,3,2,2,0,0.06284,0.29045,,,,,,,,,,,,,,,,,,,,,,,,,With,Unk,Unk,0,0,Unk because overlap with other calls,NV,NV,Display,NV,NV
347,350,EAC,Budongo,Waibira,MAC,17.11.19,chorus_ph-d_171119_01.WAV,0.09049,0.09049,0.09049,0.0,2,1,1,0,0.090491,,,,,,,,,,,,,,,,,,,,,,,,,,Without,0,0,0,0,NV,NV,NV,Display,NV,NV
348,351,EAC,Budongo,Waibira,ALF,23.11.19,ALF_ph_231119_01.WAV,0.0,0.0,0.0,0.0,1,0,0,0,,,,,,,,,,,,,,,,,,,,,,,,,,,With,Build-Up,Build-Up,1,1,No climax,NV,NV,Traveling,NV,NV
349,352,EAC,Budongo,Waibira,MAC,27.11.19,MAC_ph_271119_01.WAV,1.04435,1.04435,1.04435,0.0,5,4,4,0,0.096414,0.345266,0.320511,0.28216,,,,,,,,,,,,,,,,,,,,,,,With,Climax,Climax,2,2,NV,NV,NV,Resting,NV,NV
350,353,EAC,Budongo,Waibira,ILA,27.11.19,chorus_ph_271119_02.WAV,0.54134,0.54133,0.54133,0.0,4,3,3,0,0.074667,0.389404,0.077262,,,,,,,,,,,,,,,,,,,,,,,,With,Build-Up,Build-Up,1,1,NV,NV,NV,Unk,NV,NV
351,354,EAC,Budongo,Waibira,BEN,06.12.19,chorus_ph_061219_04.WAV,0.2973,0.2973,0.2973,0.0,2,1,1,0,0.297296,,,,,,,,,,,,,,,,,,,,,,,,,,With,Unk,Unk,0,0,Unk because overlap with other calls,NV,NV,Resting,NV,NV
352,355,EAC,Budongo,Waibira,MAS,22.12.19,MAS_ph_221219_01.WAV,0.74415,0.74415,0.74415,0.0,3,2,2,0,0.426738,0.317408,,,,,,,,,,,,,,,,,,,,,,,,,With,Build-Up,Climax,1,2,Grunty climax before climax,NV,NV,Traveling,NV,NV
353,356,EAC,Budongo,Waibira,ALF,23.12.19,ALF_ph_231219_01.WAV,0.24931,0.24931,0.24931,0.0,3,2,2,0,0.173589,0.075722,,,,,,,,,,,,,,,,,,,,,,,,,With,Climax,Climax,2,2,NV,NV,NV,Resting,NV,NV
354,357,EAC,Budongo,Waibira,BEN,23.12.19,BEN_ph_231219_05.WAV,0.31064,0.31064,0.31064,0.0,2,1,1,0,0.310636,,,,,,,,,,,,,,,,,,,,,,,,,,With,Climax,Climax,2,2,NV,NV,NV,Resting,NV,NV
355,358,EAC,Budongo,Waibira,BEN,23.12.19,BEN_ph_231219_06.WAV,0.1443,0.1443,0.1443,0.0,2,1,1,0,0.144304,,,,,,,,,,,,,,,,,,,,,,,,,,With,Build-Up,Climax,1,2,NV,NV,NV,Resting,NV,NV
356,359,EAC,Budongo,Waibira,BEN,23.12.19,BEN_ph_231219_08.WAV,0.16972,0.16972,0.16972,0.0,2,1,1,0,0.169716,,,,,,,,,,,,,,,,,,,,,,,,,,With,Let-Down,Let-Down,3,3,NV,NV,NV,Traveling,NV,NV
357,360,EAC,Budongo,Waibira,BEN,23.12.19,BEN_ph_231219_04.WAV,0.0,0.0,0.0,0.0,1,0,0,0,,,,,,,,,,,,,,,,,,,,,,,,,,,With,Climax,Climax,2,2,NV,NV,NV,Resting,NV,NV
358,361,EAC,Budongo,Waibira,BEN,28.12.19,BEN_ph_281219_02.WAV,0.27742,0.27742,0.27742,0.0,2,1,1,0,0.277423,,,,,,,,,,,,,,,,,,,,,,,,,,With,Let-Down,Let-Down,3,3,NV,NV,NV,Traveling,NV,NV
359,362,EAC,Budongo,Waibira,ALF,31.12.19,ALF_ph_311219_01.WAV,1.75302,1.75302,1.75302,0.0,4,3,3,0,0.094987,0.967995,0.690034,,,,,,,,,,,,,,,,,,,,,,,,With,Climax,Climax,2,2,NV,NV,NV,Traveling,NV,NV
360,363,EAC,Budongo,Waibira,BEN,31.12.19,BEN_ph_311219_01.WAV,0.28403,0.28403,0.28403,0.0,2,1,1,0,0.284029,,,,,,,,,,,,,,,,,,,,,,,,,,With,Build-Up,Build-Up,1,1,No climax,NV,NV,Traveling,NV,NV
361,364,EAC,Budongo,Waibira,ALF,06.01.20,chorus_ph_060120_05.WAV,0.11681,0.11681,0.11681,0.0,2,1,1,0,0.116807,,,,,,,,,,,,,,,,,,,,,,,,,,With,Climax,Climax,2,2,NV,NV,NV,Resting,NV,NV
362,365,EAC,Budongo,Waibira,ILA,17.01.20,ILA_ph_170120_01.WAV,0.09701,0.09701,0.09701,0.0,2,1,1,0,0.097014,,,,,,,,,,,,,,,,,,,,,,,,,,With,Roar,Roar,1,1,"Ph roar like BUp, No Climax",NV,NV,Resting,CAL,60
363,366,EAC,Budongo,Waibira,ILA,17.01.20,ILA_ph_170120_02.WAV,0.07516,0.07516,0.07516,0.0,2,1,1,0,0.075157,,,,,,,,,,,,,,,,,,,,,,,,,,With,Build-Up,Build-Up,1,1,Buildup  grunty,NV,NV,Traveling,NV,NV
364,367,EAC,Budongo,Waibira,MAC,18.01.20,Budongo VE 2020-01-18 Clip 2 MAC DR DISP.wav,1.4012,1.4012,1.4012,0.0,6,5,5,0,0.125572,0.231522,0.293106,0.191964,0.559038,,,,,,,,,,,,,,,,,,,,,,Without,0,0,0,0,NV,NV,NV,Display,NV,NV
365,368,EAC,Budongo,Waibira,URS,18.01.20,Budongo VE 2020-01-18 Clip 11 URS DR CYA 70 DISP.wav,1.778,1.778,1.778,0.0,6,5,5,0,0.145317,0.386251,1.041274,0.153316,0.051837,,,,,,,,,,,,,,,,,,,,,,Without,0,0,0,0,NV,NV,NV,Display,CYA,70
366,369,EAC,Budongo,Waibira,MAC,18.01.20,Budongo VE 2020-01-18 Clip 4 MAC PH-DR GR.wav,0.25626,0.25626,0.25626,0.0,3,2,2,0,0.166722,0.089536,,,,,,,,,,,,,,,,,,,,,,,,,Without,0,0,0,0,NV,NV,NV,Resting,NV,NV
367,370,EAC,Budongo,Waibira,ALF,18.01.20,Budongo VE 2020-01-18 Clip 3 ALF and GER DR DISP.wav,0.07799,0.07799,0.07799,0.0,2,1,1,0,0.077992,,,,,,,,,,,,,,,,,,,,,,,,,,Without,0,0,0,0,NV,NV,NV,Display,NV,NV
368,371,EAC,Budongo,Waibira,GER,18.01.20,Budongo VE 2020-01-18 Clip 3 ALF and GER DR DISP.wav,0.06117,0.06117,0.06117,0.0,2,1,1,0,0.06117,,,,,,,,,,,,,,,,,,,,,,,,,,Without,0,0,0,0,NV,NV,NV,Display,NV,NV
369,372,EAC,Budongo,Waibira,ILA?,18.01.20,Budongo VE 2020-01-18 Clip 14 BEN and ILA DR TR.wav,0.10546,0.10546,0.10546,0.0,2,1,1,0,0.105457,,,,,,,,,,,,,,,,,,,,,,,,,,Without,0,0,0,0,NV,NV,NV,Display,NV,NV
370,373,EAC,Budongo,Waibira,DAU,18.01.20,DAU_ph_180120_01.WAV,0.07285,0.07285,0.07285,0.0,2,1,1,0,0.072852,,,,,,,,,,,,,,,,,,,,,,,,,,Without,0,0,0,0,Before drumming ph intro,NV,NV,Traveling,NV,NV
371,374,EAC,Budongo,Waibira,MAC,18.01.20,Budongo VE 2020-01-18 Clip 1 MAC PH-DR CZE 40 TR.wav,0.0,0.0,0.0,0.0,1,0,0,0,,,,,,,,,,,,,,,,,,,,,,,,,,,With,Climax,Climax,2,2,NV,NV,NV,Traveling,CZE,40
372,375,EAC,Budongo,Waibira,MAC,19.01.20,Budongo VE 2020-01-19 Clip 3 MAC PH-DR CDU 70 TR.wav,1.92265,1.92265,1.92265,0.0,9,8,8,0,0.10294,0.249048,0.295537,0.361949,0.04981,0.31546,0.232444,0.31546,,,,,,,,,,,,,,,,,,,With,Build-Up,Build-Up,1,1,NV,NV,NV,Traveling,CDU,70
373,376,EAC,Budongo,Waibira,TAL,19.01.20,Budongo VE 2020-01-19 Clip 9 TAL DR DISP.wav,0.58142,0.58142,0.58142,0.0,4,3,3,0,0.05006,0.070085,0.461275,,,,,,,,,,,,,,,,,,,,,,,,Without,0,0,0,0,NV,NV,NV,Display,NV,NV
374,377,EAC,Budongo,Waibira,BEN,19.01.20,Budongo VE 2020-01-19 Clip 10 BEN PH-DR TR CMU 60.wav,0.61764,0.61764,0.61764,0.0,3,2,2,0,0.31546,0.302178,,,,,,,,,,,,,,,,,,,,,,,,,With,Build-Up,Build-Up,1,1,NV,NV,NV,Traveling,CMU,60
375,378,EAC,Budongo,Waibira,UNK,19.01.20,Budongo VE 2020-01-19 Clip 7 PH-DR UNK.wav,0.07056,0.07056,0.07056,0.0,2,1,1,0,0.070563,,,,,,,,,,,,,,,,,,,,,,,,,,With,Build-Up,Build-Up,1,1,NV,NV,NV,Unk,NV,NV
376,379,EAC,Budongo,Waibira,UNK,19.01.20,Budongo VE 2020-01-19 Clip 13 PH-DR UNK.wav,0.08634,0.08634,0.08634,0.0,2,1,1,0,0.086337,,,,,,,,,,,,,,,,,,,,,,,,,,With,Climax,Climax,2,2,NV,NV,NV,Unk,NV,NV
377,380,EAC,Budongo,Waibira,MAC,19.01.20,Budongo VE 2020-01-19 Clip 4 PH-DR MAC CZE 30 (1st) DISP.wav,0.10486,0.10486,0.10486,0.0,2,1,1,0,0.104857,,,,,,,,,,,,,,,,,,,,,,,,,,Without,0,0,0,0,NV,NV,NV,Display,CZE,30
378,381,EAC,Budongo,Waibira,ALF,23.01.20,Budongo VE 2020-01-23 Clip 15 ALF PH-DR 2+1 GT CYA 90.wav,0.4139,0.4139,0.4139,0.0,3,2,2,0,0.075587,0.338316,,,,,,,,,,,,,,,,,,,,,,,,,With,Climax,Climax,2,2,NV,NV,NV,Traveling,CYA,90
379,382,EAC,Budongo,Waibira,ALF,23.01.20,Budongo VE 2020-01-23 Clip 1  Alf ph-dr db GT? (not seen)MP4.wav,0.09479,0.09479,0.09479,0.0,2,1,1,0,0.094792,,,,,,,,,,,,,,,,,,,,,,,,,,With,Climax,Climax,2,2,NV,NV,NV,Unk,NV,NV
380,383,EAC,Budongo,Waibira,DAU,23.01.20,Budongo VE 2020-01-23 Clip 2 DAU ph-dr GT CYA 60.wav,0.12552,0.12552,0.12552,0.0,2,1,1,0,0.125519,,,,,,,,,,,,,,,,,,,,,,,,,,With,Climax,Climax,2,2,NV,NV,NV,Traveling,CYA,60
381,384,EAC,Budongo,Waibira,TAL,23.01.20,Budongo VE 2020-01-23 Clip 13 TAL PH-DR CYA 90 GT.wav,0.09132,0.09132,0.09132,0.0,2,1,1,0,0.091317,,,,,,,,,,,,,,,,,,,,,,,,,,Unk,Unk,Unk,0,0,NV,NV,NV,Traveling,CYA,90
382,385,EAC,Budongo,Waibira,ALF,23.01.20,Budongo VE 2020-01-23 Clip 14 ALF PH-DR db GT CMU 30.wav,0.07906,0.07906,0.07906,0.0,2,1,1,0,0.079058,,,,,,,,,,,,,,,,,,,,,,,,,,With,Climax,Climax,2,2,NV,NV,NV,Traveling,CMU,30
383,386,EAC,Budongo,Waibira,ARD?,24.01.20,Budongo VE 2020-01-24 Clip 24 ARD?-UNK PH-DR.wav,0.24905,0.24905,0.24905,0.0,3,2,2,0,0.056451,0.192597,,,,,,,,,,,,,,,,,,,,,,,,,With,Climax,Climax,2,2,NV,NV,NV,Unk,NV,NV
384,387,EAC,Budongo,Waibira,UNK,24.01.20,Budongo VE 2020-01-24 Clip 1 UNK DR.wav,0.09406,0.09406,0.09406,0.0,2,1,1,0,0.094064,,,,,,,,,,,,,,,,,,,,,,,,,,With,Build-Up,Build-Up,1,1,NV,NV,NV,Unk,NV,NV
385,388,EAC,Budongo,Waibira,UNK,24.01.20,Budongo VE 2020-01-24 Clip 2 UNK DR.wav,0.14943,0.14943,0.14943,0.0,2,1,1,0,0.149429,,,,,,,,,,,,,,,,,,,,,,,,,,With,Roar,Roar,1,1,"Ph roar, No climax",NV,NV,Unk,NV,NV
386,389,EAC,Budongo,Waibira,ILA,24.01.20,"Budongo VE 2020-01-24 Clip 11 ILA DR Disp 3 trees (CYA 60, CYA 100, UNK).wav",0.1914,0.1914,0.1914,0.0,2,1,1,0,0.191398,,,,,,,,,,,,,,,,,,,,,,,,,,Without,0,0,0,0,NV,NV,NV,Display,CYA,60
387,390,EAC,Budongo,Waibira,ILA,24.01.20,"Budongo VE 2020-01-24 Clip 11 ILA DR Disp 3 trees (CYA 60, CYA 100, UNK).wav",0.05115,0.05115,0.05115,0.0,2,1,1,0,0.05115,,,,,,,,,,,,,,,,,,,,,,,,,,Without,0,0,0,0,NV,NV,NV,Display,CYA,100
388,391,EAC,Budongo,Waibira,ILA,24.01.20,"Budongo VE 2020-01-24 Clip 11 ILA DR Disp 3 trees (CYA 60, CYA 100, UNK).wav",0.10725,0.10725,0.10725,0.0,2,1,1,0,0.107249,,,,,,,,,,,,,,,,,,,,,,,,,,Without,0,0,0,0,NV,NV,NV,Display,NV,NV
389,392,EAC,Budongo,Waibira,BEN,24.01.20,Budongo VE 2020-01-24 Clip 15 BEN DR Disp.wav,0.08922,0.08922,0.08922,0.0,2,1,1,0,0.089219,,,,,,,,,,,,,,,,,,,,,,,,,,Without,0,0,0,0,NV,NV,NV,Display,NV,NV
390,393,EAC,Budongo,Waibira,URS,24.01.20,Budongo VE 2020-01-24 Clip 29 URS PH-DR db.wav,0.09918,0.09918,0.09918,0.0,2,1,1,0,0.099176,,,,,,,,,,,,,,,,,,,,,,,,,,With,Climax,Climax,2,2,NV,NV,NV,Unk,NV,NV
